codigo,TipoVia,NombreVia,barrio,via,ViaCatastro
CL,CALLE,RIO EBRO,MURCIA,"CALLE RIO EBRO, MURCIA",RIO EBRO(CALLE) en MURCIA
CL,CALLE,RIO FRIO,MURCIA,"CALLE RIO FRIO, MURCIA",RIO FRIO(CALLE) en MURCIA
CL,CALLE,RIO GUADALENTIN,CABEZO TORRES,"CALLE RIO GUADALENTIN, CABEZO TORRES",RIO GUADALENTIN(CALLE) en CABEZO TORRES
CL,CALLE,RIO GUADALENTIN,GARRES LOS,"CALLE RIO GUADALENTIN, GARRES LOS",RIO GUADALENTIN(CALLE) en GARRES LOS
CL,CALLE,RIO GUADALENTIN,SANGONERA SECA,"CALLE RIO GUADALENTIN, SANGONERA SECA",RIO GUADALENTIN(CALLE) en SANGONERA SECA
CL,CALLE,RIO GUADALENTIN,SANGONERA VERDE,"CALLE RIO GUADALENTIN, SANGONERA VERDE",RIO GUADALENTIN(CALLE) en SANGONERA VERDE
CL,CALLE,RIO GUADALQUIVIR,COBATILLAS,"CALLE RIO GUADALQUIVIR, COBATILLAS",RIO GUADALQUIVIR(CALLE) en COBATILLAS
CL,CALLE,RIO GUADIANA,LOBOSILLO,"CALLE RIO GUADIANA, LOBOSILLO",RIO GUADIANA(CALLE) en LOBOSILLO
CL,CALLE,RIOJA,SANGONERA SECA,"CALLE RIOJA, SANGONERA SECA",RIOJA(CALLE) en SANGONERA SECA
CL,CALLE,RIOJA -UR.AGRIDULCE,GUADALUPE,"CALLE RIOJA -UR.AGRIDULCE, GUADALUPE",RIOJA -UR.AGRIDULCE(CALLE) en GUADALUPE
CL,CALLE,RIO JORDAN,SAN BENITO,"CALLE RIO JORDAN, SAN BENITO",RIO JORDAN(CALLE) en SAN BENITO
CL,CALLE,RIO JUCAR,LOBOSILLO,"CALLE RIO JUCAR, LOBOSILLO",RIO JUCAR(CALLE) en LOBOSILLO
CL,CALLE,RIO MULA,COBATILLAS,"CALLE RIO MULA, COBATILLAS",RIO MULA(CALLE) en COBATILLAS
CL,CALLE,RIO MULA,MURCIA,"CALLE RIO MULA, MURCIA",RIO MULA(CALLE) en MURCIA
CL,CALLE,RIO MUNDO -CABEZO DE T.,MURCIA,"CALLE RIO MUNDO -CABEZO DE T., MURCIA",RIO MUNDO -CABEZO DE T.(CALLE) en MURCIA
CL,CALLE,RIO MUNDO,COBATILLAS,"CALLE RIO MUNDO, COBATILLAS",RIO MUNDO(CALLE) en COBATILLAS
CL,CALLE,RIO MUNDO,EL PALMAR,"CALLE RIO MUNDO, EL PALMAR",RIO MUNDO(CALLE) en EL PALMAR
CL,CALLE,RIO MUNDO,MURCIA,"CALLE RIO MUNDO, MURCIA",RIO MUNDO(CALLE) en MURCIA
CL,CALLE,RIO MUNDO,PUENTE TOCINOS,"CALLE RIO MUNDO, PUENTE TOCINOS",RIO MUNDO(CALLE) en PUENTE TOCINOS
CL,CALLE,RIO PLIEGO,MURCIA,"CALLE RIO PLIEGO, MURCIA",RIO PLIEGO(CALLE) en MURCIA
CL,CALLE,RIO QUIPAR,MURCIA,"CALLE RIO QUIPAR, MURCIA",RIO QUIPAR(CALLE) en MURCIA
CL,CALLE,RIO SEGURA,ALQUERIAS,"CALLE RIO SEGURA, ALQUERIAS",RIO SEGURA(CALLE) en ALQUERIAS
CL,CALLE,RIO SEGURA,CABEZO TORRES,"CALLE RIO SEGURA, CABEZO TORRES",RIO SEGURA(CALLE) en CABEZO TORRES
CL,CALLE,RIO SEGURA,COBATILLAS,"CALLE RIO SEGURA, COBATILLAS",RIO SEGURA(CALLE) en COBATILLAS
CL,CALLE,RIO SEGURA,EL PALMAR,"CALLE RIO SEGURA, EL PALMAR",RIO SEGURA(CALLE) en EL PALMAR
CL,CALLE,RIO SEGURA,ESPARRAGAL,"CALLE RIO SEGURA, ESPARRAGAL",RIO SEGURA(CALLE) en ESPARRAGAL
CL,CALLE,RIO SEGURA (ESPINARDO),MURCIA,"CALLE RIO SEGURA (ESPINARDO), MURCIA",RIO SEGURA (ESPINARDO)(CALLE) en MURCIA
CL,CALLE,RIO SEGURA,LOBOSILLO,"CALLE RIO SEGURA, LOBOSILLO",RIO SEGURA(CALLE) en LOBOSILLO
CL,CALLE,RIO SENA,SAN BENITO,"CALLE RIO SENA, SAN BENITO",RIO SENA(CALLE) en SAN BENITO
CL,CALLE,RIOS,ZARANDONA,"CALLE RIOS, ZARANDONA",RIOS(CALLE) en ZARANDONA
CL,CALLE,RIO TAJO,COBATILLAS,"CALLE RIO TAJO, COBATILLAS",RIO TAJO(CALLE) en COBATILLAS
CL,CALLE,RIO TAJO,LOBOSILLO,"CALLE RIO TAJO, LOBOSILLO",RIO TAJO(CALLE) en LOBOSILLO
CL,CALLE,RIO TAJO,MURCIA,"CALLE RIO TAJO, MURCIA",RIO TAJO(CALLE) en MURCIA
CL,CALLE,RIO THADER,MURCIA,"CALLE RIO THADER, MURCIA",RIO THADER(CALLE) en MURCIA
CL,CALLE,RIQUELME,MURCIA,"CALLE RIQUELME, MURCIA",RIQUELME(CALLE) en MURCIA
CL,CALLE,RIQUELME PAREDES,ALQUERIAS,"CALLE RIQUELME PAREDES, ALQUERIAS",RIQUELME PAREDES(CALLE) en ALQUERIAS
CL,CALLE,ROBLES,MURCIA,"CALLE ROBLES, MURCIA",ROBLES(CALLE) en MURCIA
CL,CALLE,ROCAMORA,MURCIA,"CALLE ROCAMORA, MURCIA",ROCAMORA(CALLE) en MURCIA
CL,CALLE,ROCAS,ALGEZARES,"CALLE ROCAS, ALGEZARES",ROCAS(CALLE) en ALGEZARES
CL,CALLE,ROCAS,ZENETA,"CALLE ROCAS, ZENETA",ROCAS(CALLE) en ZENETA
CL,CALLE,ROCIO,ALQUERIAS,"CALLE ROCIO, ALQUERIAS",ROCIO(CALLE) en ALQUERIAS
CL,CALLE,ROCIO,COBATILLAS,"CALLE ROCIO, COBATILLAS",ROCIO(CALLE) en COBATILLAS
CL,CALLE,ROCIO,MONTEAGUDO,"CALLE ROCIO, MONTEAGUDO",ROCIO(CALLE) en MONTEAGUDO
CL,CALLE,ROCIO,MURCIA,"CALLE ROCIO, MURCIA",ROCIO(CALLE) en MURCIA
CL,CALLE,RODRIGO TRIANA,MURCIA,"CALLE RODRIGO TRIANA, MURCIA",RODRIGO TRIANA(CALLE) en MURCIA
CL,CALLE,RODRIGUEZ DE LA FUENTE,EL PALMAR,"CALLE RODRIGUEZ DE LA FUENTE, EL PALMAR",RODRIGUEZ DE LA FUENTE(CALLE) en EL PALMAR
CL,CALLE,RODRIGUEZ FUENTE,BENIAJAN,"CALLE RODRIGUEZ FUENTE, BENIAJAN",RODRIGUEZ FUENTE(CALLE) en BENIAJAN
CL,CALLE,RODRIGUEZ FUENTE,JAVALI VIEJO,"CALLE RODRIGUEZ FUENTE, JAVALI VIEJO",RODRIGUEZ FUENTE(CALLE) en JAVALI VIEJO
CL,CALLE,RODRIGUEZ FUENTE,RAMOS LOS,"CALLE RODRIGUEZ FUENTE, RAMOS LOS",RODRIGUEZ FUENTE(CALLE) en RAMOS LOS
CL,CALLE,RODRIGUEZ SAHAGUN,CABEZO TORRES,"CALLE RODRIGUEZ SAHAGUN, CABEZO TORRES",RODRIGUEZ SAHAGUN(CALLE) en CABEZO TORRES
CL,CALLE,ROLINES,SAN BENITO,"CALLE ROLINES, SAN BENITO",ROLINES(CALLE) en SAN BENITO
CL,CALLE,ROMAN ALBERCA,MURCIA,"CALLE ROMAN ALBERCA, MURCIA",ROMAN ALBERCA(CALLE) en MURCIA
CL,CALLE,ROMERAS,LOBOSILLO,"CALLE ROMERAS, LOBOSILLO",ROMERAS(CALLE) en LOBOSILLO
CL,CALLE,ROMERO,COBATILLAS,"CALLE ROMERO, COBATILLAS",ROMERO(CALLE) en COBATILLAS
CL,CALLE,ROMERO,DOLORES LOS,"CALLE ROMERO, DOLORES LOS",ROMERO(CALLE) en DOLORES LOS
CL,CALLE,ROMERO,EL PALMAR,"CALLE ROMERO, EL PALMAR",ROMERO(CALLE) en EL PALMAR
CL,CALLE,ROMERO,ESPARRAGAL,"CALLE ROMERO, ESPARRAGAL",ROMERO(CALLE) en ESPARRAGAL
CL,CALLE,ROMERO,SAN BENITO,"CALLE ROMERO, SAN BENITO",ROMERO(CALLE) en SAN BENITO
CL,CALLE,ROMERO,SANGONERA VERDE,"CALLE ROMERO, SANGONERA VERDE",ROMERO(CALLE) en SANGONERA VERDE
CL,CALLE,ROMEROS,JAVALI NUEVO,"CALLE ROMEROS, JAVALI NUEVO",ROMEROS(CALLE) en JAVALI NUEVO
CL,CALLE,ROMEROS LOS,RINCON BENISCOR,"CALLE ROMEROS LOS, RINCON BENISCOR",ROMEROS LOS(CALLE) en RINCON BENISCOR
CL,CALLE,RONCADOR,MURCIA,"CALLE RONCADOR, MURCIA",RONCADOR(CALLE) en MURCIA
CL,CALLE,RONDA GARAY,MURCIA,"CALLE RONDA GARAY, MURCIA",RONDA GARAY(CALLE) en MURCIA
CL,CALLE,RONDA NORTE,JERON.-AVILESES,"CALLE RONDA NORTE, JERON.-AVILESES",RONDA NORTE(CALLE) en JERON.-AVILESES
CL,CALLE,RONDA SUR,MURCIA,"CALLE RONDA SUR, MURCIA",RONDA SUR(CALLE) en MURCIA
CL,CALLE,ROQUE LOPEZ,ALJUCER,"CALLE ROQUE LOPEZ, ALJUCER",ROQUE LOPEZ(CALLE) en ALJUCER
CL,CALLE,ROQUE LOPEZ,MURCIA,"CALLE ROQUE LOPEZ, MURCIA",ROQUE LOPEZ(CALLE) en MURCIA
CL,CALLE,ROSAGRO,ZARANDONA,"CALLE ROSAGRO, ZARANDONA",ROSAGRO(CALLE) en ZARANDONA
CL,CALLE,ROSAL,ALGEZARES,"CALLE ROSAL, ALGEZARES",ROSAL(CALLE) en ALGEZARES
CL,CALLE,ROSALEDA,ALGEZARES,"CALLE ROSALEDA, ALGEZARES",ROSALEDA(CALLE) en ALGEZARES
CL,CALLE,ROSALEDA CALLE 1,ALGEZARES,"CALLE ROSALEDA CALLE 1, ALGEZARES",ROSALEDA CALLE 1(CALLE) en ALGEZARES
CL,CALLE,ROSALEDA CALLE 4,ALGEZARES,"CALLE ROSALEDA CALLE 4, ALGEZARES",ROSALEDA CALLE 4(CALLE) en ALGEZARES
CL,CALLE,ROSALEDA,TORREAGUERA,"CALLE ROSALEDA, TORREAGUERA",ROSALEDA(CALLE) en TORREAGUERA
CL,CALLE,ROSALES,ALBERCA LA,"CALLE ROSALES, ALBERCA LA",ROSALES(CALLE) en ALBERCA LA
CL,CALLE,ROSALES,CASILLAS,"CALLE ROSALES, CASILLAS",ROSALES(CALLE) en CASILLAS
CL,CALLE,ROSALES,SANGONERA VERDE,"CALLE ROSALES, SANGONERA VERDE",ROSALES(CALLE) en SANGONERA VERDE
CL,CALLE,ROSALIA CASTRO,BENIAJAN,"CALLE ROSALIA CASTRO, BENIAJAN",ROSALIA CASTRO(CALLE) en BENIAJAN
CL,CALLE,ROSALIA CASTRO,MARTINEZ PUERTO,"CALLE ROSALIA CASTRO, MARTINEZ PUERTO",ROSALIA CASTRO(CALLE) en MARTINEZ PUERTO
CL,CALLE,ROSALIA CASTRO,PUENTE TOCINOS,"CALLE ROSALIA CASTRO, PUENTE TOCINOS",ROSALIA CASTRO(CALLE) en PUENTE TOCINOS
CL,CALLE,ROSALIA CASTRO,ZENETA,"CALLE ROSALIA CASTRO, ZENETA",ROSALIA CASTRO(CALLE) en ZENETA
CL,CALLE,ROSALIA DE CASTRO,GUADALUPE,"CALLE ROSALIA DE CASTRO, GUADALUPE",ROSALIA DE CASTRO(CALLE) en GUADALUPE
CL,CALLE,ROSALIA DE CASTRO,SANGONERA SECA,"CALLE ROSALIA DE CASTRO, SANGONERA SECA",ROSALIA DE CASTRO(CALLE) en SANGONERA SECA
CL,CALLE,ROSALINDA,SANGONERA VERDE,"CALLE ROSALINDA, SANGONERA VERDE",ROSALINDA(CALLE) en SANGONERA VERDE
CL,CALLE,ROSAL,MURCIA,"CALLE ROSAL, MURCIA",ROSAL(CALLE) en MURCIA
CL,CALLE,ROSAL,SAN BENITO,"CALLE ROSAL, SAN BENITO",ROSAL(CALLE) en SAN BENITO
CL,CALLE,ROSAL,ZARANDONA,"CALLE ROSAL, ZARANDONA",ROSAL(CALLE) en ZARANDONA
CL,CALLE,ROSAOS,GUADALUPE,"CALLE ROSAOS, GUADALUPE",ROSAOS(CALLE) en GUADALUPE
CL,CALLE,ROSARIO,ALBERCA LA,"CALLE ROSARIO, ALBERCA LA",ROSARIO(CALLE) en ALBERCA LA
CL,CALLE,ROSARIO,ALGEZARES,"CALLE ROSARIO, ALGEZARES",ROSARIO(CALLE) en ALGEZARES
CL,CALLE,ROSARIO,BENIAJAN,"CALLE ROSARIO, BENIAJAN",ROSARIO(CALLE) en BENIAJAN
CL,CALLE,ROSARIO,CASILLAS,"CALLE ROSARIO, CASILLAS",ROSARIO(CALLE) en CASILLAS
CL,CALLE,ROSARIO,CHURRA,"CALLE ROSARIO, CHURRA",ROSARIO(CALLE) en CHURRA
CL,CALLE,ROSARIO DE ROJAS TUCON,MONTEAGUDO,"CALLE ROSARIO DE ROJAS TUCON, MONTEAGUDO",ROSARIO DE ROJAS TUCON(CALLE) en MONTEAGUDO
CL,CALLE,ROSARIO,ERA ALTA,"CALLE ROSARIO, ERA ALTA",ROSARIO(CALLE) en ERA ALTA
CL,CALLE,ROSARIO,ESPARRAGAL,"CALLE ROSARIO, ESPARRAGAL",ROSARIO(CALLE) en ESPARRAGAL
CL,CALLE,ROSARIO,GEA Y TRUYOLS,"CALLE ROSARIO, GEA Y TRUYOLS",ROSARIO(CALLE) en GEA Y TRUYOLS
CL,CALLE,ROSARIO,JAVALI NUEVO,"CALLE ROSARIO, JAVALI NUEVO",ROSARIO(CALLE) en JAVALI NUEVO
CL,CALLE,ROSARIO,JAVALI VIEJO,"CALLE ROSARIO, JAVALI VIEJO",ROSARIO(CALLE) en JAVALI VIEJO
CL,CALLE,ROSARIO,LA CUEVA,"CALLE ROSARIO, LA CUEVA",ROSARIO(CALLE) en LA CUEVA
CL,CALLE,ROSARIO,MURCIA,"CALLE ROSARIO, MURCIA",ROSARIO(CALLE) en MURCIA
CL,CALLE,ROSARIO,PUENTE TOCINOS,"CALLE ROSARIO, PUENTE TOCINOS",ROSARIO(CALLE) en PUENTE TOCINOS
CL,CALLE,ROSARIO,PUNTAL EL,"CALLE ROSARIO, PUNTAL EL",ROSARIO(CALLE) en PUNTAL EL
CL,CALLE,ROSARIO,RAMOS LOS,"CALLE ROSARIO, RAMOS LOS",ROSARIO(CALLE) en RAMOS LOS
CL,CALLE,ROSARIO,SANTO ANGEL,"CALLE ROSARIO, SANTO ANGEL",ROSARIO(CALLE) en SANTO ANGEL
CL,CALLE,ROSARIO,SUCINA,"CALLE ROSARIO, SUCINA",ROSARIO(CALLE) en SUCINA
CL,CALLE,ROSAS,COBATILLAS,"CALLE ROSAS, COBATILLAS",ROSAS(CALLE) en COBATILLAS
CL,CALLE,ROSENDOS,ZARANDONA,"CALLE ROSENDOS, ZARANDONA",ROSENDOS(CALLE) en ZARANDONA
CL,CALLE,ROSILLO,GEA Y TRUYOLS,"CALLE ROSILLO, GEA Y TRUYOLS",ROSILLO(CALLE) en GEA Y TRUYOLS
CL,CALLE,RUBEN CELIS,MURCIA,"CALLE RUBEN CELIS, MURCIA",RUBEN CELIS(CALLE) en MURCIA
CL,CALLE,RUBEN DARIO,ESPARRAGAL,"CALLE RUBEN DARIO, ESPARRAGAL",RUBEN DARIO(CALLE) en ESPARRAGAL
CL,CALLE,RUBEN DARIO,LAS LUMBRERAS,"CALLE RUBEN DARIO, LAS LUMBRERAS",RUBEN DARIO(CALLE) en LAS LUMBRERAS
CL,CALLE,RUBEN DARIO,MURCIA,"CALLE RUBEN DARIO, MURCIA",RUBEN DARIO(CALLE) en MURCIA
CL,CALLE,RUBI,MURCIA,"CALLE RUBI, MURCIA",RUBI(CALLE) en MURCIA
CL,CALLE,RUBIO ARRONIZ,ALQUERIAS,"CALLE RUBIO ARRONIZ, ALQUERIAS",RUBIO ARRONIZ(CALLE) en ALQUERIAS
CL,CALLE,RUBIO PINO,ALQUERIAS,"CALLE RUBIO PINO, ALQUERIAS",RUBIO PINO(CALLE) en ALQUERIAS
CL,CALLE,RUEDO,SAN GINES,"CALLE RUEDO, SAN GINES",RUEDO(CALLE) en SAN GINES
CL,CALLE,RUIPEREZ,MURCIA,"CALLE RUIPEREZ, MURCIA",RUIPEREZ(CALLE) en MURCIA
CL,CALLE,RUIZ,GEA Y TRUYOLS,"CALLE RUIZ, GEA Y TRUYOLS",RUIZ(CALLE) en GEA Y TRUYOLS
CL,CALLE,RUIZ HIDALGO,MURCIA,"CALLE RUIZ HIDALGO, MURCIA",RUIZ HIDALGO(CALLE) en MURCIA
CL,CALLE,SAAVEDRA FAJARDO,ALBERCA LA,"CALLE SAAVEDRA FAJARDO, ALBERCA LA",SAAVEDRA FAJARDO(CALLE) en ALBERCA LA
CL,CALLE,SAAVEDRA FAJARDO,ALGEZARES,"CALLE SAAVEDRA FAJARDO, ALGEZARES",SAAVEDRA FAJARDO(CALLE) en ALGEZARES
CL,CALLE,SAAVEDRA FAJARDO,GARRES LOS,"CALLE SAAVEDRA FAJARDO, GARRES LOS",SAAVEDRA FAJARDO(CALLE) en GARRES LOS
CL,CALLE,SAAVEDRA FAJARDO,LLANO BRUJAS,"CALLE SAAVEDRA FAJARDO, LLANO BRUJAS",SAAVEDRA FAJARDO(CALLE) en LLANO BRUJAS
CL,CALLE,SAAVEDRA FAJARDO,MURCIA,"CALLE SAAVEDRA FAJARDO, MURCIA",SAAVEDRA FAJARDO(CALLE) en MURCIA
CL,CALLE,SAAVEDRA FAJARDO,PUENTE TOCINOS,"CALLE SAAVEDRA FAJARDO, PUENTE TOCINOS",SAAVEDRA FAJARDO(CALLE) en PUENTE TOCINOS
CL,CALLE,SAAVEDRA FAJARDO,SAN GINES,"CALLE SAAVEDRA FAJARDO, SAN GINES",SAAVEDRA FAJARDO(CALLE) en SAN GINES
CL,CALLE,SAAVEDRA FAJARDO,SANGONERA SECA,"CALLE SAAVEDRA FAJARDO, SANGONERA SECA",SAAVEDRA FAJARDO(CALLE) en SANGONERA SECA
CL,CALLE,SABINAR,CHURRA,"CALLE SABINAR, CHURRA",SABINAR(CALLE) en CHURRA
CL,CALLE,SACERDOTE ANTONIO VALVERD,CABEZO TORRES,"CALLE SACERDOTE ANTONIO VALVERD, CABEZO TORRES",SACERDOTE ANTONIO VALVERD(CALLE) en CABEZO TORRES
CL,CALLE,SACERDOTE FCO GALVEZ VELA,ALQUERIAS,"CALLE SACERDOTE FCO GALVEZ VELA, ALQUERIAS",SACERDOTE FCO GALVEZ VELA(CALLE) en ALQUERIAS
CL,CALLE,SACERDOTE JOSE URRIZA,SANGONERA VERDE,"CALLE SACERDOTE JOSE URRIZA, SANGONERA VERDE",SACERDOTE JOSE URRIZA(CALLE) en SANGONERA VERDE
CL,CALLE,SACERDOTE JUAN SANCHEZ,SANGONERA VERDE,"CALLE SACERDOTE JUAN SANCHEZ, SANGONERA VERDE",SACERDOTE JUAN SANCHEZ(CALLE) en SANGONERA VERDE
CL,CALLE,SACERDOTES HERMANOS CERON,MURCIA,"CALLE SACERDOTES HERMANOS CERON, MURCIA",SACERDOTES HERMANOS CERON(CALLE) en MURCIA
CL,CALLE,SACRISTIA,ALBERCA LA,"CALLE SACRISTIA, ALBERCA LA",SACRISTIA(CALLE) en ALBERCA LA
CL,CALLE,SACRISTIA,ERA ALTA,"CALLE SACRISTIA, ERA ALTA",SACRISTIA(CALLE) en ERA ALTA
CL,CALLE,SACRISTIA SAN MIGUEL,MURCIA,"CALLE SACRISTIA SAN MIGUEL, MURCIA",SACRISTIA SAN MIGUEL(CALLE) en MURCIA
CL,CALLE,SAFO,BENIAJAN,"CALLE SAFO, BENIAJAN",SAFO(CALLE) en BENIAJAN
CL,CALLE,SAGASTA,ESPARRAGAL,"CALLE SAGASTA, ESPARRAGAL",SAGASTA(CALLE) en ESPARRAGAL
CL,CALLE,SAGASTA,MURCIA,"CALLE SAGASTA, MURCIA",SAGASTA(CALLE) en MURCIA
CL,CALLE,SAGITARIO,SANGONERA VERDE,"CALLE SAGITARIO, SANGONERA VERDE",SAGITARIO(CALLE) en SANGONERA VERDE
CL,CALLE,SAGRADA FAMILIA,SAN BENITO,"CALLE SAGRADA FAMILIA, SAN BENITO",SAGRADA FAMILIA(CALLE) en SAN BENITO
CL,CALLE,SAGRADO CORAZON,EL PALMAR,"CALLE SAGRADO CORAZON, EL PALMAR",SAGRADO CORAZON(CALLE) en EL PALMAR
CL,CALLE,SAINT ANDREWS,GEA Y TRUYOLS,"CALLE SAINT ANDREWS, GEA Y TRUYOLS",SAINT ANDREWS(CALLE) en GEA Y TRUYOLS
CL,CALLE,SALAZAR,ZARANDONA,"CALLE SALAZAR, ZARANDONA",SALAZAR(CALLE) en ZARANDONA
CL,CALLE,SALCILLO,SAN JOSE,"CALLE SALCILLO, SAN JOSE",SALCILLO(CALLE) en SAN JOSE
CL,CALLE,SAL,DOLORES LOS,"CALLE SAL, DOLORES LOS",SAL(CALLE) en DOLORES LOS
CL,CALLE,SALESIANO PACO SILVESTRE,CABEZO TORRES,"CALLE SALESIANO PACO SILVESTRE, CABEZO TORRES",SALESIANO PACO SILVESTRE(CALLE) en CABEZO TORRES
CL,CALLE,SALESIANO SALVADOR OLIVEL,CABEZO TORRES,"CALLE SALESIANO SALVADOR OLIVEL, CABEZO TORRES",SALESIANO SALVADOR OLIVEL(CALLE) en CABEZO TORRES
CL,CALLE,SALESIANOS,CABEZO TORRES,"CALLE SALESIANOS, CABEZO TORRES",SALESIANOS(CALLE) en CABEZO TORRES
CL,CALLE,SALITRE,ALBERCA LA,"CALLE SALITRE, ALBERCA LA",SALITRE(CALLE) en ALBERCA LA
CL,CALLE,SALITRE,ALGEZARES,"CALLE SALITRE, ALGEZARES",SALITRE(CALLE) en ALGEZARES
CL,CALLE,SALVADOR ALLENDE,SANGONERA VERDE,"CALLE SALVADOR ALLENDE, SANGONERA VERDE",SALVADOR ALLENDE(CALLE) en SANGONERA VERDE
CL,CALLE,SALVADOR DALI,DOLORES LOS,"CALLE SALVADOR DALI, DOLORES LOS",SALVADOR DALI(CALLE) en DOLORES LOS
CL,CALLE,SALVADOR DALI,PUNTAL EL,"CALLE SALVADOR DALI, PUNTAL EL",SALVADOR DALI(CALLE) en PUNTAL EL
CL,CALLE,SALVADOR DALI,SANGONERA SECA,"CALLE SALVADOR DALI, SANGONERA SECA",SALVADOR DALI(CALLE) en SANGONERA SECA
CL,CALLE,SALVADOR DALI,SANGONERA VERDE,"CALLE SALVADOR DALI, SANGONERA VERDE",SALVADOR DALI(CALLE) en SANGONERA VERDE
CL,CALLE,SALVADOR DALI,VALLADOLISES,"CALLE SALVADOR DALI, VALLADOLISES",SALVADOR DALI(CALLE) en VALLADOLISES
CL,CALLE,SALVADOR DE MADARIAGA,RAMOS LOS,"CALLE SALVADOR DE MADARIAGA, RAMOS LOS",SALVADOR DE MADARIAGA(CALLE) en RAMOS LOS
CL,CALLE,SALVADOR DE MADARIAGA,SANGONERA SECA,"CALLE SALVADOR DE MADARIAGA, SANGONERA SECA",SALVADOR DE MADARIAGA(CALLE) en SANGONERA SECA
CL,CALLE,SALVADOR ESPIN NOGUERA,SANGONERA VERDE,"CALLE SALVADOR ESPIN NOGUERA, SANGONERA VERDE",SALVADOR ESPIN NOGUERA(CALLE) en SANGONERA VERDE
CL,CALLE,SALVADOR MADARIAGA,MURCIA,"CALLE SALVADOR MADARIAGA, MURCIA",SALVADOR MADARIAGA(CALLE) en MURCIA
CL,CALLE,SALVADOR MADARIAGA,SANGONERA SECA,"CALLE SALVADOR MADARIAGA, SANGONERA SECA",SALVADOR MADARIAGA(CALLE) en SANGONERA SECA
CL,CALLE,SALVADOR MARTINEZ MOYA,CASILLAS,"CALLE SALVADOR MARTINEZ MOYA, CASILLAS",SALVADOR MARTINEZ MOYA(CALLE) en CASILLAS
CL,CALLE,SALVADOR REAL,BENIAJAN,"CALLE SALVADOR REAL, BENIAJAN",SALVADOR REAL(CALLE) en BENIAJAN
CL,CALLE,SALVADOR RUEDA,MURCIA,"CALLE SALVADOR RUEDA, MURCIA",SALVADOR RUEDA(CALLE) en MURCIA
CL,CALLE,SALVAORES,ZARANDONA,"CALLE SALVAORES, ZARANDONA",SALVAORES(CALLE) en ZARANDONA
CL,CALLE,SALZILLO,ALBERCA LA,"CALLE SALZILLO, ALBERCA LA",SALZILLO(CALLE) en ALBERCA LA
CL,CALLE,SALZILLO,ALGEZARES,"CALLE SALZILLO, ALGEZARES",SALZILLO(CALLE) en ALGEZARES
CL,CALLE,SALZILLO,CABEZO TORRES,"CALLE SALZILLO, CABEZO TORRES",SALZILLO(CALLE) en CABEZO TORRES
CL,CALLE,SALZILLO,EL BOJAR,"CALLE SALZILLO, EL BOJAR",SALZILLO(CALLE) en EL BOJAR
CL,CALLE,SALZILLO,EL PALMAR,"CALLE SALZILLO, EL PALMAR",SALZILLO(CALLE) en EL PALMAR
CL,CALLE,SALZILLO,ERA ALTA,"CALLE SALZILLO, ERA ALTA",SALZILLO(CALLE) en ERA ALTA
CL,CALLE,SALZILLO,GUADALUPE,"CALLE SALZILLO, GUADALUPE",SALZILLO(CALLE) en GUADALUPE
CL,CALLE,SALZILLO,MARTINEZ PUERTO,"CALLE SALZILLO, MARTINEZ PUERTO",SALZILLO(CALLE) en MARTINEZ PUERTO
CL,CALLE,SALZILLO,MONTEAGUDO,"CALLE SALZILLO, MONTEAGUDO",SALZILLO(CALLE) en MONTEAGUDO
CL,CALLE,SALZILLO,PUENTE TOCINOS,"CALLE SALZILLO, PUENTE TOCINOS",SALZILLO(CALLE) en PUENTE TOCINOS
CL,CALLE,SALZILLO,PUNTAL EL,"CALLE SALZILLO, PUNTAL EL",SALZILLO(CALLE) en PUNTAL EL
CL,CALLE,SALZILLO,RAYA LA,"CALLE SALZILLO, RAYA LA",SALZILLO(CALLE) en RAYA LA
CL,CALLE,SALZILLO,SANGONERA SECA,"CALLE SALZILLO, SANGONERA SECA",SALZILLO(CALLE) en SANGONERA SECA
CL,CALLE,SALZILLO,SANGONERA VERDE,"CALLE SALZILLO, SANGONERA VERDE",SALZILLO(CALLE) en SANGONERA VERDE
CL,CALLE,SALZILLO,SANTO ANGEL,"CALLE SALZILLO, SANTO ANGEL",SALZILLO(CALLE) en SANTO ANGEL
CL,CALLE,SALZILLO,SUCINA,"CALLE SALZILLO, SUCINA",SALZILLO(CALLE) en SUCINA
CL,CALLE,SAN AGUSTIN,EL SECANO,"CALLE SAN AGUSTIN, EL SECANO",SAN AGUSTIN(CALLE) en EL SECANO
CL,CALLE,SAN AMANCIO,EL PALMAR,"CALLE SAN AMANCIO, EL PALMAR",SAN AMANCIO(CALLE) en EL PALMAR
CL,CALLE,SAN ANDRES,GEA Y TRUYOLS,"CALLE SAN ANDRES, GEA Y TRUYOLS",SAN ANDRES(CALLE) en GEA Y TRUYOLS
CL,CALLE,SAN ANDRES,JERON.-AVILESES,"CALLE SAN ANDRES, JERON.-AVILESES",SAN ANDRES(CALLE) en JERON.-AVILESES
CL,CALLE,SAN ANDRES,MARTINEZ PUERTO,"CALLE SAN ANDRES, MARTINEZ PUERTO",SAN ANDRES(CALLE) en MARTINEZ PUERTO
CL,CALLE,SAN ANDRES,MURCIA,"CALLE SAN ANDRES, MURCIA",SAN ANDRES(CALLE) en MURCIA
CL,CALLE,SAN ANDRES,PUNTAL EL,"CALLE SAN ANDRES, PUNTAL EL",SAN ANDRES(CALLE) en PUNTAL EL
CL,CALLE,SAN ANTON ABAD,EL BOJAR,"CALLE SAN ANTON ABAD, EL BOJAR",SAN ANTON ABAD(CALLE) en EL BOJAR
CL,CALLE,SAN ANTONIO,ALBERCA LA,"CALLE SAN ANTONIO, ALBERCA LA",SAN ANTONIO(CALLE) en ALBERCA LA
CL,CALLE,SAN ANTONIO,ALGEZARES,"CALLE SAN ANTONIO, ALGEZARES",SAN ANTONIO(CALLE) en ALGEZARES
CL,CALLE,SAN ANTONIO,BARQUEROS,"CALLE SAN ANTONIO, BARQUEROS",SAN ANTONIO(CALLE) en BARQUEROS
CL,CALLE,SAN ANTONIO,BENIAJAN,"CALLE SAN ANTONIO, BENIAJAN",SAN ANTONIO(CALLE) en BENIAJAN
CL,CALLE,SAN ANTONIO,CABEZO TORRES,"CALLE SAN ANTONIO, CABEZO TORRES",SAN ANTONIO(CALLE) en CABEZO TORRES
CL,CALLE,SAN ANTONIO,CASILLAS,"CALLE SAN ANTONIO, CASILLAS",SAN ANTONIO(CALLE) en CASILLAS
CL,CALLE,SAN ANTONIO,CHURRA,"CALLE SAN ANTONIO, CHURRA",SAN ANTONIO(CALLE) en CHURRA
CL,CALLE,SAN ANTONIO,CORVERA,"CALLE SAN ANTONIO, CORVERA",SAN ANTONIO(CALLE) en CORVERA
CL,CALLE,SAN ANTONIO DE PADUA,LOBOSILLO,"CALLE SAN ANTONIO DE PADUA, LOBOSILLO",SAN ANTONIO DE PADUA(CALLE) en LOBOSILLO
CL,CALLE,SAN ANTONIO,EL PALMAR,"CALLE SAN ANTONIO, EL PALMAR",SAN ANTONIO(CALLE) en EL PALMAR
CL,CALLE,SAN ANTONIO,EL SECANO,"CALLE SAN ANTONIO, EL SECANO",SAN ANTONIO(CALLE) en EL SECANO
CL,CALLE,SAN ANTONIO,ERA ALTA,"CALLE SAN ANTONIO, ERA ALTA",SAN ANTONIO(CALLE) en ERA ALTA
CL,CALLE,SAN ANTONIO,ESPARRAGAL,"CALLE SAN ANTONIO, ESPARRAGAL",SAN ANTONIO(CALLE) en ESPARRAGAL
CL,CALLE,SAN ANTONIO,GEA Y TRUYOLS,"CALLE SAN ANTONIO, GEA Y TRUYOLS",SAN ANTONIO(CALLE) en GEA Y TRUYOLS
CL,CALLE,SAN ANTONIO,GUADALUPE,"CALLE SAN ANTONIO, GUADALUPE",SAN ANTONIO(CALLE) en GUADALUPE
CL,CALLE,SAN ANTONIO,JAVALI NUEVO,"CALLE SAN ANTONIO, JAVALI NUEVO",SAN ANTONIO(CALLE) en JAVALI NUEVO
CL,CALLE,SAN ANTONIO,JAVALI VIEJO,"CALLE SAN ANTONIO, JAVALI VIEJO",SAN ANTONIO(CALLE) en JAVALI VIEJO
CL,CALLE,SAN ANTONIO,LOBOSILLO,"CALLE SAN ANTONIO, LOBOSILLO",SAN ANTONIO(CALLE) en LOBOSILLO
CL,CALLE,SAN ANTONIO,MURCIA,"CALLE SAN ANTONIO, MURCIA",SAN ANTONIO(CALLE) en MURCIA
CL,CALLE,SAN ANTONIO POBRE,ALBERCA LA,"CALLE SAN ANTONIO POBRE, ALBERCA LA",SAN ANTONIO POBRE(CALLE) en ALBERCA LA
CL,CALLE,SAN ANTONIO,PUEBLA DE SOTO,"CALLE SAN ANTONIO, PUEBLA DE SOTO",SAN ANTONIO(CALLE) en PUEBLA DE SOTO
CL,CALLE,SAN ANTONIO,PUENTE TOCINOS,"CALLE SAN ANTONIO, PUENTE TOCINOS",SAN ANTONIO(CALLE) en PUENTE TOCINOS
CL,CALLE,SAN ANTONIO,PUNTAL EL,"CALLE SAN ANTONIO, PUNTAL EL",SAN ANTONIO(CALLE) en PUNTAL EL
CL,CALLE,SAN ANTONIO,RAAL EL,"CALLE SAN ANTONIO, RAAL EL",SAN ANTONIO(CALLE) en RAAL EL
CL,CALLE,SAN ANTONIO,RAMOS LOS,"CALLE SAN ANTONIO, RAMOS LOS",SAN ANTONIO(CALLE) en RAMOS LOS
CL,CALLE,SAN ANTONIO,RAYA LA,"CALLE SAN ANTONIO, RAYA LA",SAN ANTONIO(CALLE) en RAYA LA
CL,CALLE,SAN ANTONIO,RINCON SECA,"CALLE SAN ANTONIO, RINCON SECA",SAN ANTONIO(CALLE) en RINCON SECA
CL,CALLE,SAN ANTONIO,SANGONERA VERDE,"CALLE SAN ANTONIO, SANGONERA VERDE",SAN ANTONIO(CALLE) en SANGONERA VERDE
CL,CALLE,SAN ANTONIO,SAN JOSE,"CALLE SAN ANTONIO, SAN JOSE",SAN ANTONIO(CALLE) en SAN JOSE
CL,CALLE,SAN ANTONIO(STA M DE GRAC,MURCIA,"CALLE SAN ANTONIO(STA M DE GRAC, MURCIA",SAN ANTONIO(STA M DE GRAC(CALLE) en MURCIA
CL,CALLE,SAN ANTONIO,TORREAGUERA,"CALLE SAN ANTONIO, TORREAGUERA",SAN ANTONIO(CALLE) en TORREAGUERA
CL,CALLE,SAN ANTON,MURCIA,"CALLE SAN ANTON, MURCIA",SAN ANTON(CALLE) en MURCIA
CL,CALLE,SAN ANTON,SAN JOSE,"CALLE SAN ANTON, SAN JOSE",SAN ANTON(CALLE) en SAN JOSE
CL,CALLE,SAN BARTOLOME,EL PALMAR,"CALLE SAN BARTOLOME, EL PALMAR",SAN BARTOLOME(CALLE) en EL PALMAR
CL,CALLE,SAN BARTOLOME,JAVALI NUEVO,"CALLE SAN BARTOLOME, JAVALI NUEVO",SAN BARTOLOME(CALLE) en JAVALI NUEVO
CL,CALLE,SAN BARTOLOME,MURCIA,"CALLE SAN BARTOLOME, MURCIA",SAN BARTOLOME(CALLE) en MURCIA
CL,CALLE,SAN BASILIO,EL PALMAR,"CALLE SAN BASILIO, EL PALMAR",SAN BASILIO(CALLE) en EL PALMAR
CL,CALLE,SAN BASILIO,MURCIA,"CALLE SAN BASILIO, MURCIA",SAN BASILIO(CALLE) en MURCIA
CL,CALLE,SAN BENITO,GEA Y TRUYOLS,"CALLE SAN BENITO, GEA Y TRUYOLS",SAN BENITO(CALLE) en GEA Y TRUYOLS
CL,CALLE,SAN BENITO,MURCIA,"CALLE SAN BENITO, MURCIA",SAN BENITO(CALLE) en MURCIA
CL,CALLE,SAN BERNABE,JAVALI NUEVO,"CALLE SAN BERNABE, JAVALI NUEVO",SAN BERNABE(CALLE) en JAVALI NUEVO
CL,CALLE,SAN BLAS,ALGEZARES,"CALLE SAN BLAS, ALGEZARES",SAN BLAS(CALLE) en ALGEZARES
CL,CALLE,SAN BLAS,EL SECANO,"CALLE SAN BLAS, EL SECANO",SAN BLAS(CALLE) en EL SECANO
CL,CALLE,SAN BLAS,SAN BENITO,"CALLE SAN BLAS, SAN BENITO",SAN BLAS(CALLE) en SAN BENITO
CL,CALLE,SAN BLAS,SANGONERA VERDE,"CALLE SAN BLAS, SANGONERA VERDE",SAN BLAS(CALLE) en SANGONERA VERDE
CL,CALLE,SAN BLAS,SAN JOSE,"CALLE SAN BLAS, SAN JOSE",SAN BLAS(CALLE) en SAN JOSE
CL,CALLE,SAN CARLOS,MURCIA,"CALLE SAN CARLOS, MURCIA",SAN CARLOS(CALLE) en MURCIA
CL,CALLE,SAN CARLOS,PUNTAL EL,"CALLE SAN CARLOS, PUNTAL EL",SAN CARLOS(CALLE) en PUNTAL EL
CL,CALLE,SAN CAYETANO,BARQUEROS,"CALLE SAN CAYETANO, BARQUEROS",SAN CAYETANO(CALLE) en BARQUEROS
CL,CALLE,SAN CAYETANO,MONTEAGUDO,"CALLE SAN CAYETANO, MONTEAGUDO",SAN CAYETANO(CALLE) en MONTEAGUDO
CL,CALLE,SAN CELESTINO,SANGONERA SECA,"CALLE SAN CELESTINO, SANGONERA SECA",SAN CELESTINO(CALLE) en SANGONERA SECA
CL,CALLE,SANCHEZ BUENDIA,ALBERCA LA,"CALLE SANCHEZ BUENDIA, ALBERCA LA",SANCHEZ BUENDIA(CALLE) en ALBERCA LA
CL,CALLE,SANCHEZ MADRIGAL,MURCIA,"CALLE SANCHEZ MADRIGAL, MURCIA",SANCHEZ MADRIGAL(CALLE) en MURCIA
CL,CALLE,SANCHEZ MADRIGAL,PUNTAL EL,"CALLE SANCHEZ MADRIGAL, PUNTAL EL",SANCHEZ MADRIGAL(CALLE) en PUNTAL EL
CL,CALLE,SANCHEZ MAURANDI,MURCIA,"CALLE SANCHEZ MAURANDI, MURCIA",SANCHEZ MAURANDI(CALLE) en MURCIA
CL,CALLE,SANCHEZ NAVARRO,ALQUERIAS,"CALLE SANCHEZ NAVARRO, ALQUERIAS",SANCHEZ NAVARRO(CALLE) en ALQUERIAS
CL,CALLE,SANCHEZ POZUELO,MURCIA,"CALLE SANCHEZ POZUELO, MURCIA",SANCHEZ POZUELO(CALLE) en MURCIA
CL,CALLE,SANCHEZ Y CASTEJON,LOBOSILLO,"CALLE SANCHEZ Y CASTEJON, LOBOSILLO",SANCHEZ Y CASTEJON(CALLE) en LOBOSILLO
CL,CALLE,SANCHO,MURCIA,"CALLE SANCHO, MURCIA",SANCHO(CALLE) en MURCIA
CL,CALLE,SANCHO,SANGONERA VERDE,"CALLE SANCHO, SANGONERA VERDE",SANCHO(CALLE) en SANGONERA VERDE
CL,CALLE,SAN CRISTOBAL (ESPINARDO),MURCIA,"CALLE SAN CRISTOBAL (ESPINARDO), MURCIA",SAN CRISTOBAL (ESPINARDO)(CALLE) en MURCIA
CL,CALLE,SAN CRISTOBAL,GEA Y TRUYOLS,"CALLE SAN CRISTOBAL, GEA Y TRUYOLS",SAN CRISTOBAL(CALLE) en GEA Y TRUYOLS
CL,CALLE,SAN CRISTOBAL,MURCIA,"CALLE SAN CRISTOBAL, MURCIA",SAN CRISTOBAL(CALLE) en MURCIA
CL,CALLE,SAN CRISTOBAL,PUNTAL EL,"CALLE SAN CRISTOBAL, PUNTAL EL",SAN CRISTOBAL(CALLE) en PUNTAL EL
CL,CALLE,SAN CRISTOBAL,ZARANDONA,"CALLE SAN CRISTOBAL, ZARANDONA",SAN CRISTOBAL(CALLE) en ZARANDONA
CL,CALLE,SAN DIEGO,EL PALMAR,"CALLE SAN DIEGO, EL PALMAR",SAN DIEGO(CALLE) en EL PALMAR
CL,CALLE,SAN DIEGO,MURCIA,"CALLE SAN DIEGO, MURCIA",SAN DIEGO(CALLE) en MURCIA
CL,CALLE,SAN EUSTAQUIO,SANGONERA SECA,"CALLE SAN EUSTAQUIO, SANGONERA SECA",SAN EUSTAQUIO(CALLE) en SANGONERA SECA
CL,CALLE,SAN FELIX,CORVERA,"CALLE SAN FELIX, CORVERA",SAN FELIX(CALLE) en CORVERA
CL,CALLE,SAN FELIX,MURCIA,"CALLE SAN FELIX, MURCIA",SAN FELIX(CALLE) en MURCIA
CL,CALLE,SAN FELIX,ZARANDONA,"CALLE SAN FELIX, ZARANDONA",SAN FELIX(CALLE) en ZARANDONA
CL,CALLE,SAN FERMIN,MURCIA,"CALLE SAN FERMIN, MURCIA",SAN FERMIN(CALLE) en MURCIA
CL,CALLE,SAN FERNANDO,ALBERCA LA,"CALLE SAN FERNANDO, ALBERCA LA",SAN FERNANDO(CALLE) en ALBERCA LA
CL,CALLE,SAN FERNANDO,EL PALMAR,"CALLE SAN FERNANDO, EL PALMAR",SAN FERNANDO(CALLE) en EL PALMAR
CL,CALLE,SAN FERNANDO,MURCIA,"CALLE SAN FERNANDO, MURCIA",SAN FERNANDO(CALLE) en MURCIA
CL,CALLE,SAN FERNANDO,TORREAGUERA,"CALLE SAN FERNANDO, TORREAGUERA",SAN FERNANDO(CALLE) en TORREAGUERA
CL,CALLE,SAN FRANCISCO,ALGEZARES,"CALLE SAN FRANCISCO, ALGEZARES",SAN FRANCISCO(CALLE) en ALGEZARES
CL,CALLE,SAN FRANCISCO,ALQUERIAS,"CALLE SAN FRANCISCO, ALQUERIAS",SAN FRANCISCO(CALLE) en ALQUERIAS
CL,CALLE,SAN FRANCISCO,BARQUEROS,"CALLE SAN FRANCISCO, BARQUEROS",SAN FRANCISCO(CALLE) en BARQUEROS
CL,CALLE,SAN FRANCISCO,BENIAJAN,"CALLE SAN FRANCISCO, BENIAJAN",SAN FRANCISCO(CALLE) en BENIAJAN
