codigo,TipoVia,NombreVia,barrio,via,ViaCatastro
AL,ALAMEDA,CAPUCHINOS,MURCIA,"ALAMEDA CAPUCHINOS, MURCIA",CAPUCHINOS(ALAMEDA) en MURCIA
AL,ALAMEDA,PINOS,CHURRA,"ALAMEDA PINOS, CHURRA",PINOS(ALAMEDA) en CHURRA
AL,ALAMEDA,PINOS,PUNTAL EL,"ALAMEDA PINOS, PUNTAL EL",PINOS(ALAMEDA) en PUNTAL EL
AV,AVENIDA,1 PP INDUS SS 4-1,SANGONERA SECA,"AVENIDA 1 PP INDUS SS 4-1, SANGONERA SECA",1 PP INDUS SS 4-1(AVENIDA) en SANGONERA SECA
AV,AVENIDA,ABENARABI,MURCIA,"AVENIDA ABENARABI, MURCIA",ABENARABI(AVENIDA) en MURCIA
AV,AVENIDA,ALCANTARILLA,NONDUERMAS,"AVENIDA ALCANTARILLA, NONDUERMAS",ALCANTARILLA(AVENIDA) en NONDUERMAS
AV,AVENIDA,ALEJANDRO VALVERDE,ESPARRAGAL,"AVENIDA ALEJANDRO VALVERDE, ESPARRAGAL",ALEJANDRO VALVERDE(AVENIDA) en ESPARRAGAL
AV,AVENIDA,ALFONSO AVILES OTONS,GEA Y TRUYOLS,"AVENIDA ALFONSO AVILES OTONS, GEA Y TRUYOLS",ALFONSO AVILES OTONS(AVENIDA) en GEA Y TRUYOLS
AV,AVENIDA,ALFONSO X EL SABIO,MONTEAGUDO,"AVENIDA ALFONSO X EL SABIO, MONTEAGUDO",ALFONSO X EL SABIO(AVENIDA) en MONTEAGUDO
AV,AVENIDA,ALHAMA DE MURCIA,SANGONERA SECA,"AVENIDA ALHAMA DE MURCIA, SANGONERA SECA",ALHAMA DE MURCIA(AVENIDA) en SANGONERA SECA
AV,AVENIDA,ALICANTE,CHURRA,"AVENIDA ALICANTE, CHURRA",ALICANTE(AVENIDA) en CHURRA
AV,AVENIDA,ALICANTE,ESPARRAGAL,"AVENIDA ALICANTE, ESPARRAGAL",ALICANTE(AVENIDA) en ESPARRAGAL
AV,AVENIDA,ALICANTE,MONTEAGUDO,"AVENIDA ALICANTE, MONTEAGUDO",ALICANTE(AVENIDA) en MONTEAGUDO
AV,AVENIDA,ALICANTE,ZARANDONA,"AVENIDA ALICANTE, ZARANDONA",ALICANTE(AVENIDA) en ZARANDONA
AV,AVENIDA,ALMIRANTE LOAYSA,MURCIA,"AVENIDA ALMIRANTE LOAYSA, MURCIA",ALMIRANTE LOAYSA(AVENIDA) en MURCIA
AV,AVENIDA,AMBAR,SUCINA,"AVENIDA AMBAR, SUCINA",AMBAR(AVENIDA) en SUCINA
AV,AVENIDA,ANTONETE GALVEZ,MURCIA,"AVENIDA ANTONETE GALVEZ, MURCIA",ANTONETE GALVEZ(AVENIDA) en MURCIA
AV,AVENIDA,ANTONIO MARTINEZ GUIRAO,MURCIA,"AVENIDA ANTONIO MARTINEZ GUIRAO, MURCIA",ANTONIO MARTINEZ GUIRAO(AVENIDA) en MURCIA
AV,AVENIDA,ARQUITECTO M ANGEL BELOQU,MURCIA,"AVENIDA ARQUITECTO M ANGEL BELOQU, MURCIA",ARQUITECTO M ANGEL BELOQU(AVENIDA) en MURCIA
AV,AVENIDA,BALSICAS,GEA Y TRUYOLS,"AVENIDA BALSICAS, GEA Y TRUYOLS",BALSICAS(AVENIDA) en GEA Y TRUYOLS
AV,AVENIDA,BARRANCO DEL,SUCINA,"AVENIDA BARRANCO DEL, SUCINA",BARRANCO DEL(AVENIDA) en SUCINA
AV,AVENIDA,BENIEL,ALQUERIAS,"AVENIDA BENIEL, ALQUERIAS",BENIEL(AVENIDA) en ALQUERIAS
AV,AVENIDA,BURGOS,EL PALMAR,"AVENIDA BURGOS, EL PALMAR",BURGOS(AVENIDA) en EL PALMAR
AV,AVENIDA,CABEZO TORRES,ZARANDONA,"AVENIDA CABEZO TORRES, ZARANDONA",CABEZO TORRES(AVENIDA) en ZARANDONA
AV,AVENIDA,CANAL DEL TAIBILLA,PUNTAL EL,"AVENIDA CANAL DEL TAIBILLA, PUNTAL EL",CANAL DEL TAIBILLA(AVENIDA) en PUNTAL EL
AV,AVENIDA,CANALEJAS,MURCIA,"AVENIDA CANALEJAS, MURCIA",CANALEJAS(AVENIDA) en MURCIA
AV,AVENIDA,CANTEROS DE EL PALMAR,EL PALMAR,"AVENIDA CANTEROS DE EL PALMAR, EL PALMAR",CANTEROS DE EL PALMAR(AVENIDA) en EL PALMAR
AV,AVENIDA,CASILLAS CORIA,CASILLAS,"AVENIDA CASILLAS CORIA, CASILLAS",CASILLAS CORIA(AVENIDA) en CASILLAS
AV,AVENIDA,CASTILLO DE LA ASOMADA,EL PALMAR,"AVENIDA CASTILLO DE LA ASOMADA, EL PALMAR",CASTILLO DE LA ASOMADA(AVENIDA) en EL PALMAR
AV,AVENIDA,CASTILLO DE MONTEAGUDO,ESPARRAGAL,"AVENIDA CASTILLO DE MONTEAGUDO, ESPARRAGAL",CASTILLO DE MONTEAGUDO(AVENIDA) en ESPARRAGAL
AV,AVENIDA,CATEDRAT EUSEBIO ARANDA,CHURRA,"AVENIDA CATEDRAT EUSEBIO ARANDA, CHURRA",CATEDRAT EUSEBIO ARANDA(AVENIDA) en CHURRA
AV,AVENIDA,CEBADA,COBATILLAS,"AVENIDA CEBADA, COBATILLAS",CEBADA(AVENIDA) en COBATILLAS
AV,AVENIDA,CHOPOS,EL PALMAR,"AVENIDA CHOPOS, EL PALMAR",CHOPOS(AVENIDA) en EL PALMAR
AV,AVENIDA,CIUDAD ALMERIA,MURCIA,"AVENIDA CIUDAD ALMERIA, MURCIA",CIUDAD ALMERIA(AVENIDA) en MURCIA
AV,AVENIDA,CIUDAD DE ARANJUEZ,MURCIA,"AVENIDA CIUDAD DE ARANJUEZ, MURCIA",CIUDAD DE ARANJUEZ(AVENIDA) en MURCIA
AV,AVENIDA,CIUDAD MURCIA,EL BOJAR,"AVENIDA CIUDAD MURCIA, EL BOJAR",CIUDAD MURCIA(AVENIDA) en EL BOJAR
AV,AVENIDA,CIUDAD SANITARIA,EL PALMAR,"AVENIDA CIUDAD SANITARIA, EL PALMAR",CIUDAD SANITARIA(AVENIDA) en EL PALMAR
AV,AVENIDA,COLON,SANGONERA SECA,"AVENIDA COLON, SANGONERA SECA",COLON(AVENIDA) en SANGONERA SECA
AV,AVENIDA,CONCEJAL REMIGIO LOPEZ,CABEZO TORRES,"AVENIDA CONCEJAL REMIGIO LOPEZ, CABEZO TORRES",CONCEJAL REMIGIO LOPEZ(AVENIDA) en CABEZO TORRES
AV,AVENIDA,CONSTITUCION,ALJUCER,"AVENIDA CONSTITUCION, ALJUCER",CONSTITUCION(AVENIDA) en ALJUCER
AV,AVENIDA,CONSTITUCION,CABEZO TORRES,"AVENIDA CONSTITUCION, CABEZO TORRES",CONSTITUCION(AVENIDA) en CABEZO TORRES
AV,AVENIDA,CONSTITUCION,GUADALUPE,"AVENIDA CONSTITUCION, GUADALUPE",CONSTITUCION(AVENIDA) en GUADALUPE
AV,AVENIDA,CONSTITUCION,JERON.-AVILESES,"AVENIDA CONSTITUCION, JERON.-AVILESES",CONSTITUCION(AVENIDA) en JERON.-AVILESES
AV,AVENIDA,CONSTITUCION,MONTEAGUDO,"AVENIDA CONSTITUCION, MONTEAGUDO",CONSTITUCION(AVENIDA) en MONTEAGUDO
AV,AVENIDA,CONSTITUCION,MURCIA,"AVENIDA CONSTITUCION, MURCIA",CONSTITUCION(AVENIDA) en MURCIA
AV,AVENIDA,CONSTITUCION,SANGONERA SECA,"AVENIDA CONSTITUCION, SANGONERA SECA",CONSTITUCION(AVENIDA) en SANGONERA SECA
AV,AVENIDA,CONSTITUCION,SANGONERA VERDE,"AVENIDA CONSTITUCION, SANGONERA VERDE",CONSTITUCION(AVENIDA) en SANGONERA VERDE
AV,AVENIDA,CONSTITUCION,SUCINA,"AVENIDA CONSTITUCION, SUCINA",CONSTITUCION(AVENIDA) en SUCINA
AV,AVENIDA,CONSTITUCION,TORREAGUERA,"AVENIDA CONSTITUCION, TORREAGUERA",CONSTITUCION(AVENIDA) en TORREAGUERA
AV,AVENIDA,COSTERA NORTE,GUADALUPE,"AVENIDA COSTERA NORTE, GUADALUPE",COSTERA NORTE(AVENIDA) en GUADALUPE
AV,AVENIDA,COSTERA SUR,SANTO ANGEL,"AVENIDA COSTERA SUR, SANTO ANGEL",COSTERA SUR(AVENIDA) en SANTO ANGEL
AV,AVENIDA,CRISTO RESUCITADO,SUCINA,"AVENIDA CRISTO RESUCITADO, SUCINA",CRISTO RESUCITADO(AVENIDA) en SUCINA
AV,AVENIDA,CRONISTA CARLOS VALCARCEL,MURCIA,"AVENIDA CRONISTA CARLOS VALCARCEL, MURCIA",CRONISTA CARLOS VALCARCEL(AVENIDA) en MURCIA
AV,AVENIDA,CUARTEL,TORREAGUERA,"AVENIDA CUARTEL, TORREAGUERA",CUARTEL(AVENIDA) en TORREAGUERA
AV,AVENIDA,CULTURA,GARRES LOS,"AVENIDA CULTURA, GARRES LOS",CULTURA(AVENIDA) en GARRES LOS
AV,AVENIDA,DE CHURRA,CHURRA,"AVENIDA DE CHURRA, CHURRA",DE CHURRA(AVENIDA) en CHURRA
AV,AVENIDA,DE LA ALBERCA,ALGEZARES,"AVENIDA DE LA ALBERCA, ALGEZARES",DE LA ALBERCA(AVENIDA) en ALGEZARES
AV,AVENIDA,DE LA ALBERCA,EL PALMAR,"AVENIDA DE LA ALBERCA, EL PALMAR",DE LA ALBERCA(AVENIDA) en EL PALMAR
AV,AVENIDA,DE LA AZACAYA,DOLORES LOS,"AVENIDA DE LA AZACAYA, DOLORES LOS",DE LA AZACAYA(AVENIDA) en DOLORES LOS
AV,AVENIDA,DE LA INMACULADA,MURCIA,"AVENIDA DE LA INMACULADA, MURCIA",DE LA INMACULADA(AVENIDA) en MURCIA
AV,AVENIDA,DE LA JUVENTUD,CABEZO TORRES,"AVENIDA DE LA JUVENTUD, CABEZO TORRES",DE LA JUVENTUD(AVENIDA) en CABEZO TORRES
AV,AVENIDA,DE LA LIBERTAD,EL PALMAR,"AVENIDA DE LA LIBERTAD, EL PALMAR",DE LA LIBERTAD(AVENIDA) en EL PALMAR
AV,AVENIDA,DEL COMUN,SANGONERA SECA,"AVENIDA DEL COMUN, SANGONERA SECA",DEL COMUN(AVENIDA) en SANGONERA SECA
AV,AVENIDA,DEL MEDITERRANEO,GEA Y TRUYOLS,"AVENIDA DEL MEDITERRANEO, GEA Y TRUYOLS",DEL MEDITERRANEO(AVENIDA) en GEA Y TRUYOLS
AV,AVENIDA,DEL PUNTARRON,SANGONERA SECA,"AVENIDA DEL PUNTARRON, SANGONERA SECA",DEL PUNTARRON(AVENIDA) en SANGONERA SECA
AV,AVENIDA,DE MAZARRON,EL PALMAR,"AVENIDA DE MAZARRON, EL PALMAR",DE MAZARRON(AVENIDA) en EL PALMAR
AV,AVENIDA,DEMOCRACIA,ALJUCER,"AVENIDA DEMOCRACIA, ALJUCER",DEMOCRACIA(AVENIDA) en ALJUCER
AV,AVENIDA,DE MURCIA,CHURRA,"AVENIDA DE MURCIA, CHURRA",DE MURCIA(AVENIDA) en CHURRA
AV,AVENIDA,DOCTOR FLEMING,CHURRA,"AVENIDA DOCTOR FLEMING, CHURRA",DOCTOR FLEMING(AVENIDA) en CHURRA
AV,AVENIDA,DOCTOR PEDRO GUILLEN,MURCIA,"AVENIDA DOCTOR PEDRO GUILLEN, MURCIA",DOCTOR PEDRO GUILLEN(AVENIDA) en MURCIA
AV,AVENIDA,DOLORES,MURCIA,"AVENIDA DOLORES, MURCIA",DOLORES(AVENIDA) en MURCIA
AV,AVENIDA,DON JUAN DE BORBON,MURCIA,"AVENIDA DON JUAN DE BORBON, MURCIA",DON JUAN DE BORBON(AVENIDA) en MURCIA
AV,AVENIDA,DR PASCUAL PARRILLA PARIC,MURCIA,"AVENIDA DR PASCUAL PARRILLA PARIC, MURCIA",DR PASCUAL PARRILLA PARIC(AVENIDA) en MURCIA
AV,AVENIDA,ENRIQUE TIERNO GALVAN,PUNTAL EL,"AVENIDA ENRIQUE TIERNO GALVAN, PUNTAL EL",ENRIQUE TIERNO GALVAN(AVENIDA) en PUNTAL EL
AV,AVENIDA,ESCULTOR ANTONIO CAMPILLO,MURCIA,"AVENIDA ESCULTOR ANTONIO CAMPILLO, MURCIA",ESCULTOR ANTONIO CAMPILLO(AVENIDA) en MURCIA
AV,AVENIDA,EUROPA,MURCIA,"AVENIDA EUROPA, MURCIA",EUROPA(AVENIDA) en MURCIA
AV,AVENIDA,EUSEBIA GOMEZ,MARTINEZ PUERTO,"AVENIDA EUSEBIA GOMEZ, MARTINEZ PUERTO",EUSEBIA GOMEZ(AVENIDA) en MARTINEZ PUERTO
AV,AVENIDA,FABIAN ESCRIBANO,BENIAJAN,"AVENIDA FABIAN ESCRIBANO, BENIAJAN",FABIAN ESCRIBANO(AVENIDA) en BENIAJAN
AV,AVENIDA,FAMA,MURCIA,"AVENIDA FAMA, MURCIA",FAMA(AVENIDA) en MURCIA
AV,AVENIDA,FEDERICO GARCIA LORCA,GEA Y TRUYOLS,"AVENIDA FEDERICO GARCIA LORCA, GEA Y TRUYOLS",FEDERICO GARCIA LORCA(AVENIDA) en GEA Y TRUYOLS
AV,AVENIDA,FEDERICO GUIRAO,BENIAJAN,"AVENIDA FEDERICO GUIRAO, BENIAJAN",FEDERICO GUIRAO(AVENIDA) en BENIAJAN
AV,AVENIDA,FLOTA,MURCIA,"AVENIDA FLOTA, MURCIA",FLOTA(AVENIDA) en MURCIA
AV,AVENIDA,FRANCISCO JIMENEZ RUIZ,MURCIA,"AVENIDA FRANCISCO JIMENEZ RUIZ, MURCIA",FRANCISCO JIMENEZ RUIZ(AVENIDA) en MURCIA
AV,AVENIDA,FRONDOSO VALLEY-TORREGUIL,SANGONERA VERDE,"AVENIDA FRONDOSO VALLEY-TORREGUIL, SANGONERA VERDE",FRONDOSO VALLEY-TORREGUIL(AVENIDA) en SANGONERA VERDE
AV,AVENIDA,GENERAL ORTIN,MURCIA,"AVENIDA GENERAL ORTIN, MURCIA",GENERAL ORTIN(AVENIDA) en MURCIA
AV,AVENIDA,GENERAL PRIMO RIVERA,MURCIA,"AVENIDA GENERAL PRIMO RIVERA, MURCIA",GENERAL PRIMO RIVERA(AVENIDA) en MURCIA
AV,AVENIDA,GLORIETA,CHURRA,"AVENIDA GLORIETA, CHURRA",GLORIETA(AVENIDA) en CHURRA
AV,AVENIDA,GRAL JOSE M GOMEZ TORRES,ALJUCER,"AVENIDA GRAL JOSE M GOMEZ TORRES, ALJUCER",GRAL JOSE M GOMEZ TORRES(AVENIDA) en ALJUCER
AV,AVENIDA,HUERTA DE LA,GUADALUPE,"AVENIDA HUERTA DE LA, GUADALUPE",HUERTA DE LA(AVENIDA) en GUADALUPE
AV,AVENIDA,HUERTO SAN BLAS,TORREAGUERA,"AVENIDA HUERTO SAN BLAS, TORREAGUERA",HUERTO SAN BLAS(AVENIDA) en TORREAGUERA
AV,AVENIDA,INFANTE JUAN MANUEL,MURCIA,"AVENIDA INFANTE JUAN MANUEL, MURCIA",INFANTE JUAN MANUEL(AVENIDA) en MURCIA
AV,AVENIDA,INGENIERO JOSE ALEGRIA,ZARANDONA,"AVENIDA INGENIERO JOSE ALEGRIA, ZARANDONA",INGENIERO JOSE ALEGRIA(AVENIDA) en ZARANDONA
AV,AVENIDA,INTENDENTE JORGE PALACIOS,MURCIA,"AVENIDA INTENDENTE JORGE PALACIOS, MURCIA",INTENDENTE JORGE PALACIOS(AVENIDA) en MURCIA
AV,AVENIDA,JAIME GESTOSO,GEA Y TRUYOLS,"AVENIDA JAIME GESTOSO, GEA Y TRUYOLS",JAIME GESTOSO(AVENIDA) en GEA Y TRUYOLS
AV,AVENIDA,JAIME I CONQUISTADOR,MURCIA,"AVENIDA JAIME I CONQUISTADOR, MURCIA",JAIME I CONQUISTADOR(AVENIDA) en MURCIA
AV,AVENIDA,JARDINES DEL PRINCIPE,ZARANDONA,"AVENIDA JARDINES DEL PRINCIPE, ZARANDONA",JARDINES DEL PRINCIPE(AVENIDA) en ZARANDONA
AV,AVENIDA,JERONIMOS,GUADALUPE,"AVENIDA JERONIMOS, GUADALUPE",JERONIMOS(AVENIDA) en GUADALUPE
AV,AVENIDA,JESUS MTNEZ CORTADO,PUNTAL EL,"AVENIDA JESUS MTNEZ CORTADO, PUNTAL EL",JESUS MTNEZ CORTADO(AVENIDA) en PUNTAL EL
AV,AVENIDA,JOSE BAUTISTA FRUTOS,PUNTAL EL,"AVENIDA JOSE BAUTISTA FRUTOS, PUNTAL EL",JOSE BAUTISTA FRUTOS(AVENIDA) en PUNTAL EL
AV,AVENIDA,JOSE MARIA GUILLAMON,TORREAGUERA,"AVENIDA JOSE MARIA GUILLAMON, TORREAGUERA",JOSE MARIA GUILLAMON(AVENIDA) en TORREAGUERA
AV,AVENIDA,JOVEN FUTURA,ESPINARDO,"AVENIDA JOVEN FUTURA, ESPINARDO",JOVEN FUTURA(AVENIDA) en ESPINARDO
AV,AVENIDA,JUANA JUGAN,MURCIA,"AVENIDA JUANA JUGAN, MURCIA",JUANA JUGAN(AVENIDA) en MURCIA
AV,AVENIDA,JUAN ANTONIO PEREA,MURCIA,"AVENIDA JUAN ANTONIO PEREA, MURCIA",JUAN ANTONIO PEREA(AVENIDA) en MURCIA
AV,AVENIDA,JUAN CARLOS I,CORVERA,"AVENIDA JUAN CARLOS I, CORVERA",JUAN CARLOS I(AVENIDA) en CORVERA
AV,AVENIDA,JUAN CARLOS I,GARRES LOS,"AVENIDA JUAN CARLOS I, GARRES LOS",JUAN CARLOS I(AVENIDA) en GARRES LOS
AV,AVENIDA,JUAN CARLOS I,GUADALUPE,"AVENIDA JUAN CARLOS I, GUADALUPE",JUAN CARLOS I(AVENIDA) en GUADALUPE
AV,AVENIDA,JUAN CARLOS I,MARTINEZ PUERTO,"AVENIDA JUAN CARLOS I, MARTINEZ PUERTO",JUAN CARLOS I(AVENIDA) en MARTINEZ PUERTO
AV,AVENIDA,JUAN CARLOS I,MURCIA,"AVENIDA JUAN CARLOS I, MURCIA",JUAN CARLOS I(AVENIDA) en MURCIA
AV,AVENIDA,JUAN CARLOS I,RAMOS LOS,"AVENIDA JUAN CARLOS I, RAMOS LOS",JUAN CARLOS I(AVENIDA) en RAMOS LOS
AV,AVENIDA,JUAN CARLOS I,SANTO ANGEL,"AVENIDA JUAN CARLOS I, SANTO ANGEL",JUAN CARLOS I(AVENIDA) en SANTO ANGEL
AV,AVENIDA,JUAN CARLOS I,ZENETA,"AVENIDA JUAN CARLOS I, ZENETA",JUAN CARLOS I(AVENIDA) en ZENETA
AV,AVENIDA,JUAN CIERVA,MURCIA,"AVENIDA JUAN CIERVA, MURCIA",JUAN CIERVA(AVENIDA) en MURCIA
AV,AVENIDA,JUAN PABLO II,MURCIA,"AVENIDA JUAN PABLO II, MURCIA",JUAN PABLO II(AVENIDA) en MURCIA
AV,AVENIDA,JUAN RAMON JIMENEZ,ESPARRAGAL,"AVENIDA JUAN RAMON JIMENEZ, ESPARRAGAL",JUAN RAMON JIMENEZ(AVENIDA) en ESPARRAGAL
AV,AVENIDA,JUAN XXIII,CABEZO TORRES,"AVENIDA JUAN XXIII, CABEZO TORRES",JUAN XXIII(AVENIDA) en CABEZO TORRES
AV,AVENIDA,JUSTICIA DE LA,MURCIA,"AVENIDA JUSTICIA DE LA, MURCIA",JUSTICIA DE LA(AVENIDA) en MURCIA
AV,AVENIDA,JUSTO QUESADA,JERON.-AVILESES,"AVENIDA JUSTO QUESADA, JERON.-AVILESES",JUSTO QUESADA(AVENIDA) en JERON.-AVILESES
AV,AVENIDA,JUVENTUD,CABEZO TORRES,"AVENIDA JUVENTUD, CABEZO TORRES",JUVENTUD(AVENIDA) en CABEZO TORRES
AV,AVENIDA,LA RAYA,RINCON SECA,"AVENIDA LA RAYA, RINCON SECA",LA RAYA(AVENIDA) en RINCON SECA
AV,AVENIDA,LEVANTE,MURCIA,"AVENIDA LEVANTE, MURCIA",LEVANTE(AVENIDA) en MURCIA
AV,AVENIDA,LIBERTAD,CASILLAS,"AVENIDA LIBERTAD, CASILLAS",LIBERTAD(AVENIDA) en CASILLAS
AV,AVENIDA,LIBERTAD DE LA,SAN GINES,"AVENIDA LIBERTAD DE LA, SAN GINES",LIBERTAD DE LA(AVENIDA) en SAN GINES
AV,AVENIDA,LIBERTAD,EL PALMAR,"AVENIDA LIBERTAD, EL PALMAR",LIBERTAD(AVENIDA) en EL PALMAR
AV,AVENIDA,LIBERTAD,GUADALUPE,"AVENIDA LIBERTAD, GUADALUPE",LIBERTAD(AVENIDA) en GUADALUPE
AV,AVENIDA,LIBERTAD,JERON.-AVILESES,"AVENIDA LIBERTAD, JERON.-AVILESES",LIBERTAD(AVENIDA) en JERON.-AVILESES
AV,AVENIDA,LIBERTAD,MURCIA,"AVENIDA LIBERTAD, MURCIA",LIBERTAD(AVENIDA) en MURCIA
AV,AVENIDA,LIBERTAD,RAMOS LOS,"AVENIDA LIBERTAD, RAMOS LOS",LIBERTAD(AVENIDA) en RAMOS LOS
AV,AVENIDA,LIBERTAD,SAN BENITO,"AVENIDA LIBERTAD, SAN BENITO",LIBERTAD(AVENIDA) en SAN BENITO
AV,AVENIDA,LIBERTAD,SANGONERA VERDE,"AVENIDA LIBERTAD, SANGONERA VERDE",LIBERTAD(AVENIDA) en SANGONERA VERDE
AV,AVENIDA,LIBERTAD,SAN JOSE,"AVENIDA LIBERTAD, SAN JOSE",LIBERTAD(AVENIDA) en SAN JOSE
AV,AVENIDA,LIBERTAD,SUCINA,"AVENIDA LIBERTAD, SUCINA",LIBERTAD(AVENIDA) en SUCINA
AV,AVENIDA,LIDOS,MONTEAGUDO,"AVENIDA LIDOS, MONTEAGUDO",LIDOS(AVENIDA) en MONTEAGUDO
AV,AVENIDA,LOPE VEGA,MURCIA,"AVENIDA LOPE VEGA, MURCIA",LOPE VEGA(AVENIDA) en MURCIA
AV,AVENIDA,LORCA,SANGONERA SECA,"AVENIDA LORCA, SANGONERA SECA",LORCA(AVENIDA) en SANGONERA SECA
AV,AVENIDA,LOS CARROS,GEA Y TRUYOLS,"AVENIDA LOS CARROS, GEA Y TRUYOLS",LOS CARROS(AVENIDA) en GEA Y TRUYOLS
AV,AVENIDA,MADRID,PUNTAL EL,"AVENIDA MADRID, PUNTAL EL",MADRID(AVENIDA) en PUNTAL EL
AV,AVENIDA,MAESTROS LOS,BENIAJAN,"AVENIDA MAESTROS LOS, BENIAJAN",MAESTROS LOS(AVENIDA) en BENIAJAN
AV,AVENIDA,MAJAL BLANCO -TORREGUIL,SANGONERA VERDE,"AVENIDA MAJAL BLANCO -TORREGUIL, SANGONERA VERDE",MAJAL BLANCO -TORREGUIL(AVENIDA) en SANGONERA VERDE
AV,AVENIDA,MANUEL GALAN,JERON.-AVILESES,"AVENIDA MANUEL GALAN, JERON.-AVILESES",MANUEL GALAN(AVENIDA) en JERON.-AVILESES
AV,AVENIDA,MARIANO ROJAS,MURCIA,"AVENIDA MARIANO ROJAS, MURCIA",MARIANO ROJAS(AVENIDA) en MURCIA
AV,AVENIDA,MARIANO ROJAS,PUENTE TOCINOS,"AVENIDA MARIANO ROJAS, PUENTE TOCINOS",MARIANO ROJAS(AVENIDA) en PUENTE TOCINOS
AV,AVENIDA,MARIAS LAS,SUCINA,"AVENIDA MARIAS LAS, SUCINA",MARIAS LAS(AVENIDA) en SUCINA
AV,AVENIDA,MARQUES DE ESPINARDO,ESPINARDO,"AVENIDA MARQUES DE ESPINARDO, ESPINARDO",MARQUES DE ESPINARDO(AVENIDA) en ESPINARDO
AV,AVENIDA,MARQUES VELEZ,MURCIA,"AVENIDA MARQUES VELEZ, MURCIA",MARQUES VELEZ(AVENIDA) en MURCIA
AV,AVENIDA,MARTIRES,MURCIA,"AVENIDA MARTIRES, MURCIA",MARTIRES(AVENIDA) en MURCIA
AV,AVENIDA,MERCAMURCIA,EL PALMAR,"AVENIDA MERCAMURCIA, EL PALMAR",MERCAMURCIA(AVENIDA) en EL PALMAR
AV,AVENIDA,MIGUEL ANGEL BLANCO,MURCIA,"AVENIDA MIGUEL ANGEL BLANCO, MURCIA",MIGUEL ANGEL BLANCO(AVENIDA) en MURCIA
AV,AVENIDA,MIGUEL DE CERVANTES,MURCIA,"AVENIDA MIGUEL DE CERVANTES, MURCIA",MIGUEL DE CERVANTES(AVENIDA) en MURCIA
AV,AVENIDA,MIGUEL INDURAIN,MURCIA,"AVENIDA MIGUEL INDURAIN, MURCIA",MIGUEL INDURAIN(AVENIDA) en MURCIA
AV,AVENIDA,MONTEAGUDO,CASILLAS,"AVENIDA MONTEAGUDO, CASILLAS",MONTEAGUDO(AVENIDA) en CASILLAS
AV,AVENIDA,MONTEAZAHAR,BENIAJAN,"AVENIDA MONTEAZAHAR, BENIAJAN",MONTEAZAHAR(AVENIDA) en BENIAJAN
AV,AVENIDA,MONTE CARMELO,MURCIA,"AVENIDA MONTE CARMELO, MURCIA",MONTE CARMELO(AVENIDA) en MURCIA
AV,AVENIDA,MONTEGRANDE-SECANO,TORREAGUERA,"AVENIDA MONTEGRANDE-SECANO, TORREAGUERA",MONTEGRANDE-SECANO(AVENIDA) en TORREAGUERA
AV,AVENIDA,MURCIA,CABEZO TORRES,"AVENIDA MURCIA, CABEZO TORRES",MURCIA(AVENIDA) en CABEZO TORRES
AV,AVENIDA,MURCIA,PUEBLA DE SOTO,"AVENIDA MURCIA, PUEBLA DE SOTO",MURCIA(AVENIDA) en PUEBLA DE SOTO
AV,AVENIDA,MURCIA,RAMOS LOS,"AVENIDA MURCIA, RAMOS LOS",MURCIA(AVENIDA) en RAMOS LOS
AV,AVENIDA,NARCISOS,COBATILLAS,"AVENIDA NARCISOS, COBATILLAS",NARCISOS(AVENIDA) en COBATILLAS
AV,AVENIDA,NIETAS LAS,SUCINA,"AVENIDA NIETAS LAS, SUCINA",NIETAS LAS(AVENIDA) en SUCINA
AV,AVENIDA,PADRE MARTINEZ,RAYA LA,"AVENIDA PADRE MARTINEZ, RAYA LA",PADRE MARTINEZ(AVENIDA) en RAYA LA
AV,AVENIDA,PALMAR DEL,MURCIA,"AVENIDA PALMAR DEL, MURCIA",PALMAR DEL(AVENIDA) en MURCIA
AV,AVENIDA,PALMERAL DE ZARAICHE,MURCIA,"AVENIDA PALMERAL DE ZARAICHE, MURCIA",PALMERAL DE ZARAICHE(AVENIDA) en MURCIA
AV,AVENIDA,PALMERAS,EL PALMAR,"AVENIDA PALMERAS, EL PALMAR",PALMERAS(AVENIDA) en EL PALMAR
AV,AVENIDA,PALMITOS,SUCINA,"AVENIDA PALMITOS, SUCINA",PALMITOS(AVENIDA) en SUCINA
AV,AVENIDA,PALOMA,ERA ALTA,"AVENIDA PALOMA, ERA ALTA",PALOMA(AVENIDA) en ERA ALTA
AV,AVENIDA,PARQUE CHURRA-THADER,CHURRA,"AVENIDA PARQUE CHURRA-THADER, CHURRA",PARQUE CHURRA-THADER(AVENIDA) en CHURRA
AV,AVENIDA,PATRICIO VALVERDE ESPIN,MURCIA,"AVENIDA PATRICIO VALVERDE ESPIN, MURCIA",PATRICIO VALVERDE ESPIN(AVENIDA) en MURCIA
AV,AVENIDA,PATRULLA AGUILA,MURCIA,"AVENIDA PATRULLA AGUILA, MURCIA",PATRULLA AGUILA(AVENIDA) en MURCIA
AV,AVENIDA,PAZ,EL PALMAR,"AVENIDA PAZ, EL PALMAR",PAZ(AVENIDA) en EL PALMAR
AV,AVENIDA,PEDRO DIAZ CASSOU,MONTEAGUDO,"AVENIDA PEDRO DIAZ CASSOU, MONTEAGUDO",PEDRO DIAZ CASSOU(AVENIDA) en MONTEAGUDO
AV,AVENIDA,PEREZ URRUTI,PUNTAL EL,"AVENIDA PEREZ URRUTI, PUNTAL EL",PEREZ URRUTI(AVENIDA) en PUNTAL EL
AV,AVENIDA,PICOS DE EUROPA,ESPARRAGAL,"AVENIDA PICOS DE EUROPA, ESPARRAGAL",PICOS DE EUROPA(AVENIDA) en ESPARRAGAL
AV,AVENIDA,PINOS,MURCIA,"AVENIDA PINOS, MURCIA",PINOS(AVENIDA) en MURCIA
AV,AVENIDA,PINTOR PEDRO CANO,EL PALMAR,"AVENIDA PINTOR PEDRO CANO, EL PALMAR",PINTOR PEDRO CANO(AVENIDA) en EL PALMAR
AV,AVENIDA,PIO BAROJA,GUADALUPE,"AVENIDA PIO BAROJA, GUADALUPE",PIO BAROJA(AVENIDA) en GUADALUPE
AV,AVENIDA,PIO BAROJA,MURCIA,"AVENIDA PIO BAROJA, MURCIA",PIO BAROJA(AVENIDA) en MURCIA
AV,AVENIDA,POETA MIGUEL HERNANDEZ,GEA Y TRUYOLS,"AVENIDA POETA MIGUEL HERNANDEZ, GEA Y TRUYOLS",POETA MIGUEL HERNANDEZ(AVENIDA) en GEA Y TRUYOLS
AV,AVENIDA,PRIMERO DE MAYO,EL PALMAR,"AVENIDA PRIMERO DE MAYO, EL PALMAR",PRIMERO DE MAYO(AVENIDA) en EL PALMAR
AV,AVENIDA,PRIMERO DE MAYO,GUADALUPE,"AVENIDA PRIMERO DE MAYO, GUADALUPE",PRIMERO DE MAYO(AVENIDA) en GUADALUPE
AV,AVENIDA,PRIMERO DE MAYO,MURCIA,"AVENIDA PRIMERO DE MAYO, MURCIA",PRIMERO DE MAYO(AVENIDA) en MURCIA
AV,AVENIDA,PRIMERO MAYO,PUNTAL EL,"AVENIDA PRIMERO MAYO, PUNTAL EL",PRIMERO MAYO(AVENIDA) en PUNTAL EL
AV,AVENIDA,PRINCIPAL,SAN GINES,"AVENIDA PRINCIPAL, SAN GINES",PRINCIPAL(AVENIDA) en SAN GINES
AV,AVENIDA,PRINCIPE ASTURIAS,ESPARRAGAL,"AVENIDA PRINCIPE ASTURIAS, ESPARRAGAL",PRINCIPE ASTURIAS(AVENIDA) en ESPARRAGAL
AV,AVENIDA,PRINCIPE ASTURIAS,LAS LUMBRERAS,"AVENIDA PRINCIPE ASTURIAS, LAS LUMBRERAS",PRINCIPE ASTURIAS(AVENIDA) en LAS LUMBRERAS
AV,AVENIDA,PRINCIPE ASTURIAS,MURCIA,"AVENIDA PRINCIPE ASTURIAS, MURCIA",PRINCIPE ASTURIAS(AVENIDA) en MURCIA
AV,AVENIDA,PRINCIPE DE ASTURIAS,GUADALUPE,"AVENIDA PRINCIPE DE ASTURIAS, GUADALUPE",PRINCIPE DE ASTURIAS(AVENIDA) en GUADALUPE
AV,AVENIDA,PROGRESO DEL,SAN BENITO,"AVENIDA PROGRESO DEL, SAN BENITO",PROGRESO DEL(AVENIDA) en SAN BENITO
AV,AVENIDA,PROGRESO,EL PALMAR,"AVENIDA PROGRESO, EL PALMAR",PROGRESO(AVENIDA) en EL PALMAR
AV,AVENIDA,PROGRESO,GARRES LOS,"AVENIDA PROGRESO, GARRES LOS",PROGRESO(AVENIDA) en GARRES LOS
AV,AVENIDA,PUENTE TOCINOS,CASILLAS,"AVENIDA PUENTE TOCINOS, CASILLAS",PUENTE TOCINOS(AVENIDA) en CASILLAS
AV,AVENIDA,PUENTE TOCINOS,LLANO BRUJAS,"AVENIDA PUENTE TOCINOS, LLANO BRUJAS",PUENTE TOCINOS(AVENIDA) en LLANO BRUJAS
AV,AVENIDA,RAMBLA DEL PUERTO,EL PALMAR,"AVENIDA RAMBLA DEL PUERTO, EL PALMAR",RAMBLA DEL PUERTO(AVENIDA) en EL PALMAR
AV,AVENIDA,RAYA,PUEBLA DE SOTO,"AVENIDA RAYA, PUEBLA DE SOTO",RAYA(AVENIDA) en PUEBLA DE SOTO
AV,AVENIDA,RAYA,RAYA LA,"AVENIDA RAYA, RAYA LA",RAYA(AVENIDA) en RAYA LA
AV,AVENIDA,REAL ACADEMIA DE MEDICINA,MURCIA,"AVENIDA REAL ACADEMIA DE MEDICINA, MURCIA",REAL ACADEMIA DE MEDICINA(AVENIDA) en MURCIA
AV,AVENIDA,RECTORES,PUNTAL EL,"AVENIDA RECTORES, PUNTAL EL",RECTORES(AVENIDA) en PUNTAL EL
AV,AVENIDA,RECTOR LOUSTAU,MURCIA,"AVENIDA RECTOR LOUSTAU, MURCIA",RECTOR LOUSTAU(AVENIDA) en MURCIA
AV,AVENIDA,REGION DE MURCIA,BENIAJAN,"AVENIDA REGION DE MURCIA, BENIAJAN",REGION DE MURCIA(AVENIDA) en BENIAJAN
AV,AVENIDA,REGION DE MURCIA,DOLORES LOS,"AVENIDA REGION DE MURCIA, DOLORES LOS",REGION DE MURCIA(AVENIDA) en DOLORES LOS
AV,AVENIDA,REGION DE MURCIA,GUADALUPE,"AVENIDA REGION DE MURCIA, GUADALUPE",REGION DE MURCIA(AVENIDA) en GUADALUPE
AV,AVENIDA,REGION MURCIA,TORREAGUERA,"AVENIDA REGION MURCIA, TORREAGUERA",REGION MURCIA(AVENIDA) en TORREAGUERA
AV,AVENIDA,REINA SOFIA,GUADALUPE,"AVENIDA REINA SOFIA, GUADALUPE",REINA SOFIA(AVENIDA) en GUADALUPE
AV,AVENIDA,REINA SOFIA,MARTINEZ PUERTO,"AVENIDA REINA SOFIA, MARTINEZ PUERTO",REINA SOFIA(AVENIDA) en MARTINEZ PUERTO
AV,AVENIDA,REINA SOFIA,SANGONERA VERDE,"AVENIDA REINA SOFIA, SANGONERA VERDE",REINA SOFIA(AVENIDA) en SANGONERA VERDE
AV,AVENIDA,REINA SOFIA,SAN JOSE,"AVENIDA REINA SOFIA, SAN JOSE",REINA SOFIA(AVENIDA) en SAN JOSE
AV,AVENIDA,REINO DE MURCIA,MURCIA,"AVENIDA REINO DE MURCIA, MURCIA",REINO DE MURCIA(AVENIDA) en MURCIA
AV,AVENIDA,REINO DE VALENCIA,ZARANDONA,"AVENIDA REINO DE VALENCIA, ZARANDONA",REINO DE VALENCIA(AVENIDA) en ZARANDONA
AV,AVENIDA,REYES CATOLICOS,GUADALUPE,"AVENIDA REYES CATOLICOS, GUADALUPE",REYES CATOLICOS(AVENIDA) en GUADALUPE
AV,AVENIDA,REYES CATOLICOS,MURCIA,"AVENIDA REYES CATOLICOS, MURCIA",REYES CATOLICOS(AVENIDA) en MURCIA
AV,AVENIDA,RICARDO GOMEZ,MARTINEZ PUERTO,"AVENIDA RICARDO GOMEZ, MARTINEZ PUERTO",RICARDO GOMEZ(AVENIDA) en MARTINEZ PUERTO
AV,AVENIDA,RINCON DE SECA,RAYA LA,"AVENIDA RINCON DE SECA, RAYA LA",RINCON DE SECA(AVENIDA) en RAYA LA
AV,AVENIDA,RIO GUADALENTIN,SANTO ANGEL,"AVENIDA RIO GUADALENTIN, SANTO ANGEL",RIO GUADALENTIN(AVENIDA) en SANTO ANGEL
AV,AVENIDA,RIO MADERA,MURCIA,"AVENIDA RIO MADERA, MURCIA",RIO MADERA(AVENIDA) en MURCIA
AV,AVENIDA,RIO SECO,SANGONERA SECA,"AVENIDA RIO SECO, SANGONERA SECA",RIO SECO(AVENIDA) en SANGONERA SECA
AV,AVENIDA,RIO SEGURA,LLANO BRUJAS,"AVENIDA RIO SEGURA, LLANO BRUJAS",RIO SEGURA(AVENIDA) en LLANO BRUJAS
AV,AVENIDA,RIO SEGURA,MURCIA,"AVENIDA RIO SEGURA, MURCIA",RIO SEGURA(AVENIDA) en MURCIA
AV,AVENIDA,RIO SEGURA,RINCON BENISCOR,"AVENIDA RIO SEGURA, RINCON BENISCOR",RIO SEGURA(AVENIDA) en RINCON BENISCOR
AV,AVENIDA,ROCIO,MURCIA,"AVENIDA ROCIO, MURCIA",ROCIO(AVENIDA) en MURCIA
AV,AVENIDA,RONDA OESTE,MURCIA,"AVENIDA RONDA OESTE, MURCIA",RONDA OESTE(AVENIDA) en MURCIA
AV,AVENIDA,ROSALES,EL PALMAR,"AVENIDA ROSALES, EL PALMAR",ROSALES(AVENIDA) en EL PALMAR
AV,AVENIDA,SAN FERNANDO,SAN JOSE,"AVENIDA SAN FERNANDO, SAN JOSE",SAN FERNANDO(AVENIDA) en SAN JOSE
AV,AVENIDA,SAN GINES,SAN GINES,"AVENIDA SAN GINES, SAN GINES",SAN GINES(AVENIDA) en SAN GINES
AV,AVENIDA,SAN JOSE,SAN JOSE,"AVENIDA SAN JOSE, SAN JOSE",SAN JOSE(AVENIDA) en SAN JOSE
AV,AVENIDA,SAN JUAN CRUZ,MURCIA,"AVENIDA SAN JUAN CRUZ, MURCIA",SAN JUAN CRUZ(AVENIDA) en MURCIA
AV,AVENIDA,SAN PEDRO DEL PINATAR,MURCIA,"AVENIDA SAN PEDRO DEL PINATAR, MURCIA",SAN PEDRO DEL PINATAR(AVENIDA) en MURCIA
AV,AVENIDA,SAN ROQUE,COBATILLAS,"AVENIDA SAN ROQUE, COBATILLAS",SAN ROQUE(AVENIDA) en COBATILLAS
AV,AVENIDA,SANTA CATALINA,ALBERCA LA,"AVENIDA SANTA CATALINA, ALBERCA LA",SANTA CATALINA(AVENIDA) en ALBERCA LA
AV,AVENIDA,SANTA CATALINA,ALJUCER,"AVENIDA SANTA CATALINA, ALJUCER",SANTA CATALINA(AVENIDA) en ALJUCER
AV,AVENIDA,SANTIAGO,MURCIA,"AVENIDA SANTIAGO, MURCIA",SANTIAGO(AVENIDA) en MURCIA
AV,AVENIDA,SANTIAGO,S.Y ZARAICHE,"AVENIDA SANTIAGO, S.Y ZARAICHE",SANTIAGO(AVENIDA) en S.Y ZARAICHE
AV,AVENIDA,SANTIAGO,ZARANDONA,"AVENIDA SANTIAGO, ZARANDONA",SANTIAGO(AVENIDA) en ZARANDONA
AV,AVENIDA,SANTOMERA,ALQUERIAS,"AVENIDA SANTOMERA, ALQUERIAS",SANTOMERA(AVENIDA) en ALQUERIAS
AV,AVENIDA,SEVERO OCHOA,PUNTAL EL,"AVENIDA SEVERO OCHOA, PUNTAL EL",SEVERO OCHOA(AVENIDA) en PUNTAL EL
AV,AVENIDA,SIERRA DE LOS VILLARES,GEA Y TRUYOLS,"AVENIDA SIERRA DE LOS VILLARES, GEA Y TRUYOLS",SIERRA DE LOS VILLARES(AVENIDA) en GEA Y TRUYOLS
AV,AVENIDA,TENIENTE FLOMESTA,MURCIA,"AVENIDA TENIENTE FLOMESTA, MURCIA",TENIENTE FLOMESTA(AVENIDA) en MURCIA
AV,AVENIDA,TENIENTE MONTESINOS,ESPINARDO,"AVENIDA TENIENTE MONTESINOS, ESPINARDO",TENIENTE MONTESINOS(AVENIDA) en ESPINARDO
AV,AVENIDA,TIERNO GALVAN,GUADALUPE,"AVENIDA TIERNO GALVAN, GUADALUPE",TIERNO GALVAN(AVENIDA) en GUADALUPE
AV,AVENIDA,TORRE ALCAINA,CHURRA,"AVENIDA TORRE ALCAINA, CHURRA",TORRE ALCAINA(AVENIDA) en CHURRA
AV,AVENIDA,TORRE ALCAYNA,PUNTAL EL,"AVENIDA TORRE ALCAYNA, PUNTAL EL",TORRE ALCAYNA(AVENIDA) en PUNTAL EL
AV,AVENIDA,TORRE DE VILLESCAS,PUENTE TOCINOS,"AVENIDA TORRE DE VILLESCAS, PUENTE TOCINOS",TORRE DE VILLESCAS(AVENIDA) en PUENTE TOCINOS
AV,AVENIDA,VALDEMINAS,ESPARRAGAL,"AVENIDA VALDEMINAS, ESPARRAGAL",VALDEMINAS(AVENIDA) en ESPARRAGAL
AV,AVENIDA,VALLE DEL GUADALENTIN,SANGONERA VERDE,"AVENIDA VALLE DEL GUADALENTIN, SANGONERA VERDE",VALLE DEL GUADALENTIN(AVENIDA) en SANGONERA VERDE
AV,AVENIDA,VERDOLAY,SANTO ANGEL,"AVENIDA VERDOLAY, SANTO ANGEL",VERDOLAY(AVENIDA) en SANTO ANGEL
AV,AVENIDA,VEREDA REAL,SANGONERA SECA,"AVENIDA VEREDA REAL, SANGONERA SECA",VEREDA REAL(AVENIDA) en SANGONERA SECA
AV,AVENIDA,VICTOR GARRIGOS,CHURRA,"AVENIDA VICTOR GARRIGOS, CHURRA",VICTOR GARRIGOS(AVENIDA) en CHURRA
AV,AVENIDA,VICTORIA,MURCIA,"AVENIDA VICTORIA, MURCIA",VICTORIA(AVENIDA) en MURCIA
