codigo,TipoVia,NombreVia,barrio,via,ViaCatastro
CL,CALLE,GUSTAVO ADOLFO BECQUER,CHURRA,"CALLE GUSTAVO ADOLFO BECQUER, CHURRA",GUSTAVO ADOLFO BECQUER(CALLE) en CHURRA
CL,CALLE,GUSTAVO ADOLFO BECQUER,GUADALUPE,"CALLE GUSTAVO ADOLFO BECQUER, GUADALUPE",GUSTAVO ADOLFO BECQUER(CALLE) en GUADALUPE
CL,CALLE,GUTIERREZ MELLADO,CABEZO TORRES,"CALLE GUTIERREZ MELLADO, CABEZO TORRES",GUTIERREZ MELLADO(CALLE) en CABEZO TORRES
CL,CALLE,GUTIERREZ MELLADO,MURCIA,"CALLE GUTIERREZ MELLADO, MURCIA",GUTIERREZ MELLADO(CALLE) en MURCIA
CL,CALLE,GUTIERREZ MELLADO,RAMOS LOS,"CALLE GUTIERREZ MELLADO, RAMOS LOS",GUTIERREZ MELLADO(CALLE) en RAMOS LOS
CL,CALLE,G ZB GP2,GUADALUPE,"CALLE G ZB GP2, GUADALUPE",G ZB GP2(CALLE) en GUADALUPE
CL,CALLE,H1,MURCIA,"CALLE H1, MURCIA",H1(CALLE) en MURCIA
CL,CALLE,H4,MURCIA,"CALLE H4, MURCIA",H4(CALLE) en MURCIA
CL,CALLE,HACIENDA DEL CURA,JAVALI VIEJO,"CALLE HACIENDA DEL CURA, JAVALI VIEJO",HACIENDA DEL CURA(CALLE) en JAVALI VIEJO
CL,CALLE,HACIENDA RIQUELME VIAL A,SUCINA,"CALLE HACIENDA RIQUELME VIAL A, SUCINA",HACIENDA RIQUELME VIAL A(CALLE) en SUCINA
CL,CALLE,HACIENDA RIQUELME VIAL C,SUCINA,"CALLE HACIENDA RIQUELME VIAL C, SUCINA",HACIENDA RIQUELME VIAL C(CALLE) en SUCINA
CL,CALLE,HACIENDA RIQUELME VIAL D,SUCINA,"CALLE HACIENDA RIQUELME VIAL D, SUCINA",HACIENDA RIQUELME VIAL D(CALLE) en SUCINA
CL,CALLE,HACIENDA RIQUEL VIAL B,SUCINA,"CALLE HACIENDA RIQUEL VIAL B, SUCINA",HACIENDA RIQUEL VIAL B(CALLE) en SUCINA
CL,CALLE,HACIEN RIQUELME VIAL PRAL,SUCINA,"CALLE HACIEN RIQUELME VIAL PRAL, SUCINA",HACIEN RIQUELME VIAL PRAL(CALLE) en SUCINA
CL,CALLE,HANNOVER,MONTEAGUDO,"CALLE HANNOVER, MONTEAGUDO",HANNOVER(CALLE) en MONTEAGUDO
CL,CALLE,HERACLITO,GARRES LOS,"CALLE HERACLITO, GARRES LOS",HERACLITO(CALLE) en GARRES LOS
CL,CALLE,HEREDEROS,DOLORES LOS,"CALLE HEREDEROS, DOLORES LOS",HEREDEROS(CALLE) en DOLORES LOS
CL,CALLE,HERMANOS GOMEZ,MURCIA,"CALLE HERMANOS GOMEZ, MURCIA",HERMANOS GOMEZ(CALLE) en MURCIA
CL,CALLE,HERMANOS SERRANO TORTAJAD,MURCIA,"CALLE HERMANOS SERRANO TORTAJAD, MURCIA",HERMANOS SERRANO TORTAJAD(CALLE) en MURCIA
CL,CALLE,HERNAN CORTES,CABEZO TORRES,"CALLE HERNAN CORTES, CABEZO TORRES",HERNAN CORTES(CALLE) en CABEZO TORRES
CL,CALLE,HERNAN CORTES,CORVERA,"CALLE HERNAN CORTES, CORVERA",HERNAN CORTES(CALLE) en CORVERA
CL,CALLE,HERNAN CORTES,GUADALUPE,"CALLE HERNAN CORTES, GUADALUPE",HERNAN CORTES(CALLE) en GUADALUPE
CL,CALLE,HERNAN CORTES,RAMOS LOS,"CALLE HERNAN CORTES, RAMOS LOS",HERNAN CORTES(CALLE) en RAMOS LOS
CL,CALLE,HERNAN CORTES,SANGONERA VERDE,"CALLE HERNAN CORTES, SANGONERA VERDE",HERNAN CORTES(CALLE) en SANGONERA VERDE
CL,CALLE,HERNANDEZ MORA,BENIAJAN,"CALLE HERNANDEZ MORA, BENIAJAN",HERNANDEZ MORA(CALLE) en BENIAJAN
CL,CALLE,HERRADURA,MURCIA,"CALLE HERRADURA, MURCIA",HERRADURA(CALLE) en MURCIA
CL,CALLE,HERRERIA,SANGONERA VERDE,"CALLE HERRERIA, SANGONERA VERDE",HERRERIA(CALLE) en SANGONERA VERDE
CL,CALLE,HERRERIA,ZENETA,"CALLE HERRERIA, ZENETA",HERRERIA(CALLE) en ZENETA
CL,CALLE,HERRERO FATIGAS,GARRES LOS,"CALLE HERRERO FATIGAS, GARRES LOS",HERRERO FATIGAS(CALLE) en GARRES LOS
CL,CALLE,HERRERO,GARRES LOS,"CALLE HERRERO, GARRES LOS",HERRERO(CALLE) en GARRES LOS
CL,CALLE,HERREROS,ESPARRAGAL,"CALLE HERREROS, ESPARRAGAL",HERREROS(CALLE) en ESPARRAGAL
CL,CALLE,HERREROS,PUENTE TOCINOS,"CALLE HERREROS, PUENTE TOCINOS",HERREROS(CALLE) en PUENTE TOCINOS
CL,CALLE,HERREROS,ZARANDONA,"CALLE HERREROS, ZARANDONA",HERREROS(CALLE) en ZARANDONA
CL,CALLE,HIDALGO,MURCIA,"CALLE HIDALGO, MURCIA",HIDALGO(CALLE) en MURCIA
CL,CALLE,HIEDRA,COBATILLAS,"CALLE HIEDRA, COBATILLAS",HIEDRA(CALLE) en COBATILLAS
CL,CALLE,HIEDRA - TORREGUIL,SANGONERA VERDE,"CALLE HIEDRA - TORREGUIL, SANGONERA VERDE",HIEDRA - TORREGUIL(CALLE) en SANGONERA VERDE
CL,CALLE,HIERBABUENA,COBATILLAS,"CALLE HIERBABUENA, COBATILLAS",HIERBABUENA(CALLE) en COBATILLAS
CL,CALLE,HIERBA BUENA,TORREAGUERA,"CALLE HIERBA BUENA, TORREAGUERA",HIERBA BUENA(CALLE) en TORREAGUERA
CL,CALLE,HIGINIO NICOLAS,EL SECANO,"CALLE HIGINIO NICOLAS, EL SECANO",HIGINIO NICOLAS(CALLE) en EL SECANO
CL,CALLE,HIGUERA,CABEZO TORRES,"CALLE HIGUERA, CABEZO TORRES",HIGUERA(CALLE) en CABEZO TORRES
CL,CALLE,HIGUERA,SANGONERA VERDE,"CALLE HIGUERA, SANGONERA VERDE",HIGUERA(CALLE) en SANGONERA VERDE
CL,CALLE,HIGUERAS,MURCIA,"CALLE HIGUERAS, MURCIA",HIGUERAS(CALLE) en MURCIA
CL,CALLE,HIGUERAS,SAN JOSE,"CALLE HIGUERAS, SAN JOSE",HIGUERAS(CALLE) en SAN JOSE
CL,CALLE,HILANDERAS,MURCIA,"CALLE HILANDERAS, MURCIA",HILANDERAS(CALLE) en MURCIA
CL,CALLE,HINOJO,SANGONERA VERDE,"CALLE HINOJO, SANGONERA VERDE",HINOJO(CALLE) en SANGONERA VERDE
CL,CALLE,HINOJOS,SUCINA,"CALLE HINOJOS, SUCINA",HINOJOS(CALLE) en SUCINA
CL,CALLE,HISPANIDAD,EL BOJAR,"CALLE HISPANIDAD, EL BOJAR",HISPANIDAD(CALLE) en EL BOJAR
CL,CALLE,HIST JUAN TORRES FONTES,MURCIA,"CALLE HIST JUAN TORRES FONTES, MURCIA",HIST JUAN TORRES FONTES(CALLE) en MURCIA
CL,CALLE,HISTORIADOR ANTONIO SOLIS,CABEZO TORRES,"CALLE HISTORIADOR ANTONIO SOLIS, CABEZO TORRES",HISTORIADOR ANTONIO SOLIS(CALLE) en CABEZO TORRES
CL,CALLE,HISTORIADOR FCO MATEOS,GUADALUPE,"CALLE HISTORIADOR FCO MATEOS, GUADALUPE",HISTORIADOR FCO MATEOS(CALLE) en GUADALUPE
CL,CALLE,HITA,ALBERCA LA,"CALLE HITA, ALBERCA LA",HITA(CALLE) en ALBERCA LA
CL,CALLE,HOMERO,GARRES LOS,"CALLE HOMERO, GARRES LOS",HOMERO(CALLE) en GARRES LOS
CL,CALLE,HONDA,BARQUEROS,"CALLE HONDA, BARQUEROS",HONDA(CALLE) en BARQUEROS
CL,CALLE,HONESTIDAD,ALBERCA LA,"CALLE HONESTIDAD, ALBERCA LA",HONESTIDAD(CALLE) en ALBERCA LA
CL,CALLE,HORACIO,GARRES LOS,"CALLE HORACIO, GARRES LOS",HORACIO(CALLE) en GARRES LOS
CL,CALLE,HORNO,BARQUEROS,"CALLE HORNO, BARQUEROS",HORNO(CALLE) en BARQUEROS
CL,CALLE,HORNO,BENIAJAN,"CALLE HORNO, BENIAJAN",HORNO(CALLE) en BENIAJAN
CL,CALLE,HORNO (EL CARMEN),MURCIA,"CALLE HORNO (EL CARMEN), MURCIA",HORNO (EL CARMEN)(CALLE) en MURCIA
CL,CALLE,HORNO,EL PALMAR,"CALLE HORNO, EL PALMAR",HORNO(CALLE) en EL PALMAR
CL,CALLE,HORNO,GUADALUPE,"CALLE HORNO, GUADALUPE",HORNO(CALLE) en GUADALUPE
CL,CALLE,HORNO,JAVALI NUEVO,"CALLE HORNO, JAVALI NUEVO",HORNO(CALLE) en JAVALI NUEVO
CL,CALLE,HORNO,JERON.-AVILESES,"CALLE HORNO, JERON.-AVILESES",HORNO(CALLE) en JERON.-AVILESES
CL,CALLE,HORNO,RAYA LA,"CALLE HORNO, RAYA LA",HORNO(CALLE) en RAYA LA
CL,CALLE,HORNO,SAN GINES,"CALLE HORNO, SAN GINES",HORNO(CALLE) en SAN GINES
CL,CALLE,HORNO (STA EULALIA),MURCIA,"CALLE HORNO (STA EULALIA), MURCIA",HORNO (STA EULALIA)(CALLE) en MURCIA
CL,CALLE,HORNO (STGO Y ZARAICHE),MURCIA,"CALLE HORNO (STGO Y ZARAICHE), MURCIA",HORNO (STGO Y ZARAICHE)(CALLE) en MURCIA
CL,CALLE,HORNO,TORREAGUERA,"CALLE HORNO, TORREAGUERA",HORNO(CALLE) en TORREAGUERA
CL,CALLE,HORTELANOS,MURCIA,"CALLE HORTELANOS, MURCIA",HORTELANOS(CALLE) en MURCIA
CL,CALLE,H PP ZU-SU-JA3,JERON.-AVILESES,"CALLE H PP ZU-SU-JA3, JERON.-AVILESES",H PP ZU-SU-JA3(CALLE) en JERON.-AVILESES
CL,CALLE,H SECTOR ZB-PM7,EL PALMAR,"CALLE H SECTOR ZB-PM7, EL PALMAR",H SECTOR ZB-PM7(CALLE) en EL PALMAR
CL,CALLE,H UA1 PP ZM-GR3,SAN BENITO,"CALLE H UA1 PP ZM-GR3, SAN BENITO",H UA1 PP ZM-GR3(CALLE) en SAN BENITO
CL,CALLE,HUERTA,CHURRA,"CALLE HUERTA, CHURRA",HUERTA(CALLE) en CHURRA
CL,CALLE,HUERTA DE MURCIA,RAAL EL,"CALLE HUERTA DE MURCIA, RAAL EL",HUERTA DE MURCIA(CALLE) en RAAL EL
CL,CALLE,HUERTA,EL PALMAR,"CALLE HUERTA, EL PALMAR",HUERTA(CALLE) en EL PALMAR
CL,CALLE,HUERTA,JAVALI NUEVO,"CALLE HUERTA, JAVALI NUEVO",HUERTA(CALLE) en JAVALI NUEVO
CL,CALLE,HUERTA,LLANO BRUJAS,"CALLE HUERTA, LLANO BRUJAS",HUERTA(CALLE) en LLANO BRUJAS
CL,CALLE,HUERTA MURCIA,GUADALUPE,"CALLE HUERTA MURCIA, GUADALUPE",HUERTA MURCIA(CALLE) en GUADALUPE
CL,CALLE,HUERTANO ANTONIO TERUEL,ESPINARDO,"CALLE HUERTANO ANTONIO TERUEL, ESPINARDO",HUERTANO ANTONIO TERUEL(CALLE) en ESPINARDO
CL,CALLE,HUERTAS,MURCIA,"CALLE HUERTAS, MURCIA",HUERTAS(CALLE) en MURCIA
CL,CALLE,HUERTO,ALGEZARES,"CALLE HUERTO, ALGEZARES",HUERTO(CALLE) en ALGEZARES
CL,CALLE,HUERTO ALIX,SAN BENITO,"CALLE HUERTO ALIX, SAN BENITO",HUERTO ALIX(CALLE) en SAN BENITO
CL,CALLE,HUERTO CADENAS,MURCIA,"CALLE HUERTO CADENAS, MURCIA",HUERTO CADENAS(CALLE) en MURCIA
CL,CALLE,HUERTO CAPUCHINOS,MURCIA,"CALLE HUERTO CAPUCHINOS, MURCIA",HUERTO CAPUCHINOS(CALLE) en MURCIA
CL,CALLE,HUERTO DE LOS ORTINES,GUADALUPE,"CALLE HUERTO DE LOS ORTINES, GUADALUPE",HUERTO DE LOS ORTINES(CALLE) en GUADALUPE
CL,CALLE,HUERTO GAMBIN,MURCIA,"CALLE HUERTO GAMBIN, MURCIA",HUERTO GAMBIN(CALLE) en MURCIA
CL,CALLE,HUERTO MANU,MURCIA,"CALLE HUERTO MANU, MURCIA",HUERTO MANU(CALLE) en MURCIA
CL,CALLE,HUERTO,MURCIA,"CALLE HUERTO, MURCIA",HUERTO(CALLE) en MURCIA
CL,CALLE,HUERTO PICO,BENIAJAN,"CALLE HUERTO PICO, BENIAJAN",HUERTO PICO(CALLE) en BENIAJAN
CL,CALLE,HUERTO POMARES,MURCIA,"CALLE HUERTO POMARES, MURCIA",HUERTO POMARES(CALLE) en MURCIA
CL,CALLE,HUERTOS,ALBERCA LA,"CALLE HUERTOS, ALBERCA LA",HUERTOS(CALLE) en ALBERCA LA
CL,CALLE,HUERTO,SANGONERA VERDE,"CALLE HUERTO, SANGONERA VERDE",HUERTO(CALLE) en SANGONERA VERDE
CL,CALLE,HUERTO SIMONES,GARRES LOS,"CALLE HUERTO SIMONES, GARRES LOS",HUERTO SIMONES(CALLE) en GARRES LOS
CL,CALLE,HUERTOS,MARTINEZ PUERTO,"CALLE HUERTOS, MARTINEZ PUERTO",HUERTOS(CALLE) en MARTINEZ PUERTO
CL,CALLE,HUERTOS,SAN JOSE,"CALLE HUERTOS, SAN JOSE",HUERTOS(CALLE) en SAN JOSE
CL,CALLE,HUESCA,MURCIA,"CALLE HUESCA, MURCIA",HUESCA(CALLE) en MURCIA
CL,CALLE,H ZB GP2,GUADALUPE,"CALLE H ZB GP2, GUADALUPE",H ZB GP2(CALLE) en GUADALUPE
CL,CALLE,H (ZM-SA1),SANTO ANGEL,"CALLE H (ZM-SA1), SANTO ANGEL",H (ZM-SA1)(CALLE) en SANTO ANGEL
CL,CALLE,IGLESIA,ALGEZARES,"CALLE IGLESIA, ALGEZARES",IGLESIA(CALLE) en ALGEZARES
CL,CALLE,IGLESIA,ALJUCER,"CALLE IGLESIA, ALJUCER",IGLESIA(CALLE) en ALJUCER
CL,CALLE,IGLESIA ALTA,GARRES LOS,"CALLE IGLESIA ALTA, GARRES LOS",IGLESIA ALTA(CALLE) en GARRES LOS
CL,CALLE,IGLESIA,CABEZO TORRES,"CALLE IGLESIA, CABEZO TORRES",IGLESIA(CALLE) en CABEZO TORRES
CL,CALLE,IGLESIA,CORVERA,"CALLE IGLESIA, CORVERA",IGLESIA(CALLE) en CORVERA
CL,CALLE,IGLESIA,DOLORES LOS,"CALLE IGLESIA, DOLORES LOS",IGLESIA(CALLE) en DOLORES LOS
CL,CALLE,IGLESIA,ERA ALTA,"CALLE IGLESIA, ERA ALTA",IGLESIA(CALLE) en ERA ALTA
CL,CALLE,IGLESIA,GARRES LOS,"CALLE IGLESIA, GARRES LOS",IGLESIA(CALLE) en GARRES LOS
CL,CALLE,IGLESIA,GEA Y TRUYOLS,"CALLE IGLESIA, GEA Y TRUYOLS",IGLESIA(CALLE) en GEA Y TRUYOLS
CL,CALLE,IGLESIA,JERON.-AVILESES,"CALLE IGLESIA, JERON.-AVILESES",IGLESIA(CALLE) en JERON.-AVILESES
CL,CALLE,IGLESIA,MONTEAGUDO,"CALLE IGLESIA, MONTEAGUDO",IGLESIA(CALLE) en MONTEAGUDO
CL,CALLE,IGLESIA,SAN BENITO,"CALLE IGLESIA, SAN BENITO",IGLESIA(CALLE) en SAN BENITO
CL,CALLE,IGLESIA,SANGONERA VERDE,"CALLE IGLESIA, SANGONERA VERDE",IGLESIA(CALLE) en SANGONERA VERDE
CL,CALLE,IGLESIA,SAN JOSE,"CALLE IGLESIA, SAN JOSE",IGLESIA(CALLE) en SAN JOSE
CL,CALLE,IGLESIA (STGO Y ZARAICHE),MURCIA,"CALLE IGLESIA (STGO Y ZARAICHE), MURCIA",IGLESIA (STGO Y ZARAICHE)(CALLE) en MURCIA
CL,CALLE,IGLESIA,VALLADOLISES,"CALLE IGLESIA, VALLADOLISES",IGLESIA(CALLE) en VALLADOLISES
CL,CALLE,IGNACIO DE VILLA,COBATILLAS,"CALLE IGNACIO DE VILLA, COBATILLAS",IGNACIO DE VILLA(CALLE) en COBATILLAS
CL,CALLE,IGNACIO GALERA MURCIA,ALJUCER,"CALLE IGNACIO GALERA MURCIA, ALJUCER",IGNACIO GALERA MURCIA(CALLE) en ALJUCER
CL,CALLE,IGNACIO MARTIN,MURCIA,"CALLE IGNACIO MARTIN, MURCIA",IGNACIO MARTIN(CALLE) en MURCIA
CL,CALLE,IGUAZU,ESPARRAGAL,"CALLE IGUAZU, ESPARRAGAL",IGUAZU(CALLE) en ESPARRAGAL
CL,CALLE,ILIADA,GARRES LOS,"CALLE ILIADA, GARRES LOS",ILIADA(CALLE) en GARRES LOS
CL,CALLE,INAZARES,EL PALMAR,"CALLE INAZARES, EL PALMAR",INAZARES(CALLE) en EL PALMAR
CL,CALLE,INAZARES,ESPARRAGAL,"CALLE INAZARES, ESPARRAGAL",INAZARES(CALLE) en ESPARRAGAL
CL,CALLE,INDEPENDENCIA,SANGONERA VERDE,"CALLE INDEPENDENCIA, SANGONERA VERDE",INDEPENDENCIA(CALLE) en SANGONERA VERDE
CL,CALLE,INDUSTRIA,CASILLAS,"CALLE INDUSTRIA, CASILLAS",INDUSTRIA(CALLE) en CASILLAS
CL,CALLE,INDUSTRIA,CHURRA,"CALLE INDUSTRIA, CHURRA",INDUSTRIA(CALLE) en CHURRA
CL,CALLE,INDUSTRIAL,ERA ALTA,"CALLE INDUSTRIAL, ERA ALTA",INDUSTRIAL(CALLE) en ERA ALTA
CL,CALLE,INDUSTRIA,MURCIA,"CALLE INDUSTRIA, MURCIA",INDUSTRIA(CALLE) en MURCIA
CL,CALLE,INDUSTRIA,RAMOS LOS,"CALLE INDUSTRIA, RAMOS LOS",INDUSTRIA(CALLE) en RAMOS LOS
CL,CALLE,INDUSTRIA,SANGONERA VERDE,"CALLE INDUSTRIA, SANGONERA VERDE",INDUSTRIA(CALLE) en SANGONERA VERDE
CL,CALLE,INDUSTRIA,SANTA CRUZ,"CALLE INDUSTRIA, SANTA CRUZ",INDUSTRIA(CALLE) en SANTA CRUZ
CL,CALLE,INDUSTRIA,ZARANDONA,"CALLE INDUSTRIA, ZARANDONA",INDUSTRIA(CALLE) en ZARANDONA
CL,CALLE,INFANCIA,DOLORES LOS,"CALLE INFANCIA, DOLORES LOS",INFANCIA(CALLE) en DOLORES LOS
CL,CALLE,INFANTA CRISTINA,ALJUCER,"CALLE INFANTA CRISTINA, ALJUCER",INFANTA CRISTINA(CALLE) en ALJUCER
CL,CALLE,INFANTA CRISTINA,CHURRA,"CALLE INFANTA CRISTINA, CHURRA",INFANTA CRISTINA(CALLE) en CHURRA
CL,CALLE,INFANTA CRISTINA,MURCIA,"CALLE INFANTA CRISTINA, MURCIA",INFANTA CRISTINA(CALLE) en MURCIA
CL,CALLE,INFANTA CRISTINA,PUENTE TOCINOS,"CALLE INFANTA CRISTINA, PUENTE TOCINOS",INFANTA CRISTINA(CALLE) en PUENTE TOCINOS
CL,CALLE,INFANTA CRISTINA,SANGONERA VERDE,"CALLE INFANTA CRISTINA, SANGONERA VERDE",INFANTA CRISTINA(CALLE) en SANGONERA VERDE
CL,CALLE,INFANTA ELENA,CABEZO TORRES,"CALLE INFANTA ELENA, CABEZO TORRES",INFANTA ELENA(CALLE) en CABEZO TORRES
CL,CALLE,INFANTA ELENA,GARRES LOS,"CALLE INFANTA ELENA, GARRES LOS",INFANTA ELENA(CALLE) en GARRES LOS
CL,CALLE,INFANTA ELENA,MURCIA,"CALLE INFANTA ELENA, MURCIA",INFANTA ELENA(CALLE) en MURCIA
CL,CALLE,INFANTA ELENA,SANGONERA VERDE,"CALLE INFANTA ELENA, SANGONERA VERDE",INFANTA ELENA(CALLE) en SANGONERA VERDE
CL,CALLE,INFANTA SOFIA,DOLORES LOS,"CALLE INFANTA SOFIA, DOLORES LOS",INFANTA SOFIA(CALLE) en DOLORES LOS
CL,CALLE,INFANTES,MURCIA,"CALLE INFANTES, MURCIA",INFANTES(CALLE) en MURCIA
CL,CALLE,ING. ANGEL VAZQUEZ HEREDI,SANTA CRUZ,"CALLE ING. ANGEL VAZQUEZ HEREDI, SANTA CRUZ",ING. ANGEL VAZQUEZ HEREDI(CALLE) en SANTA CRUZ
CL,CALLE,INGENIERO BRYANT,MURCIA,"CALLE INGENIERO BRYANT, MURCIA",INGENIERO BRYANT(CALLE) en MURCIA
CL,CALLE,INGENIERO MELCHOR LUZON,MURCIA,"CALLE INGENIERO MELCHOR LUZON, MURCIA",INGENIERO MELCHOR LUZON(CALLE) en MURCIA
CL,CALLE,ING JOSE M LOPEZ HDEZ,PUNTAL EL,"CALLE ING JOSE M LOPEZ HDEZ, PUNTAL EL",ING JOSE M LOPEZ HDEZ(CALLE) en PUNTAL EL
CL,CALLE,ING JUAN DE LA CIERVA,SAN GINES,"CALLE ING JUAN DE LA CIERVA, SAN GINES",ING JUAN DE LA CIERVA(CALLE) en SAN GINES
CL,CALLE,INIESTAS,MURCIA,"CALLE INIESTAS, MURCIA",INIESTAS(CALLE) en MURCIA
CL,CALLE,INMACULADA,GARRES LOS,"CALLE INMACULADA, GARRES LOS",INMACULADA(CALLE) en GARRES LOS
CL,CALLE,INMACULADA,MURCIA,"CALLE INMACULADA, MURCIA",INMACULADA(CALLE) en MURCIA
CL,CALLE,INMACULADA,RAMOS LOS,"CALLE INMACULADA, RAMOS LOS",INMACULADA(CALLE) en RAMOS LOS
CL,CALLE,INOCENCIO MESEGUER,ALQUERIAS,"CALLE INOCENCIO MESEGUER, ALQUERIAS",INOCENCIO MESEGUER(CALLE) en ALQUERIAS
CL,CALLE,INSTITUTO,BENIAJAN,"CALLE INSTITUTO, BENIAJAN",INSTITUTO(CALLE) en BENIAJAN
CL,CALLE,INVESTIGADORA MARG. SALAS,ALBERCA LA,"CALLE INVESTIGADORA MARG. SALAS, ALBERCA LA",INVESTIGADORA MARG. SALAS(CALLE) en ALBERCA LA
CL,CALLE,INV MIGUEL MARIN PADILLA,ESPARRAGAL,"CALLE INV MIGUEL MARIN PADILLA, ESPARRAGAL",INV MIGUEL MARIN PADILLA(CALLE) en ESPARRAGAL
CL,CALLE,IRENE VILLA,EL PALMAR,"CALLE IRENE VILLA, EL PALMAR",IRENE VILLA(CALLE) en EL PALMAR
CL,CALLE,IRIS,TORREAGUERA,"CALLE IRIS, TORREAGUERA",IRIS(CALLE) en TORREAGUERA
CL,CALLE,ISAAC ALBENIZ,MURCIA,"CALLE ISAAC ALBENIZ, MURCIA",ISAAC ALBENIZ(CALLE) en MURCIA
CL,CALLE,ISAAC ALBENIZ,RAMOS LOS,"CALLE ISAAC ALBENIZ, RAMOS LOS",ISAAC ALBENIZ(CALLE) en RAMOS LOS
CL,CALLE,ISAAC PERAL,ALGEZARES,"CALLE ISAAC PERAL, ALGEZARES",ISAAC PERAL(CALLE) en ALGEZARES
CL,CALLE,ISAAC PERAL,BENIAJAN,"CALLE ISAAC PERAL, BENIAJAN",ISAAC PERAL(CALLE) en BENIAJAN
CL,CALLE,ISAAC PERAL,CABEZO TORRES,"CALLE ISAAC PERAL, CABEZO TORRES",ISAAC PERAL(CALLE) en CABEZO TORRES
CL,CALLE,ISAAC PERAL,EL PALMAR,"CALLE ISAAC PERAL, EL PALMAR",ISAAC PERAL(CALLE) en EL PALMAR
CL,CALLE,ISAAC PERAL,ESPARRAGAL,"CALLE ISAAC PERAL, ESPARRAGAL",ISAAC PERAL(CALLE) en ESPARRAGAL
CL,CALLE,ISAAC PERAL,MARTINEZ PUERTO,"CALLE ISAAC PERAL, MARTINEZ PUERTO",ISAAC PERAL(CALLE) en MARTINEZ PUERTO
CL,CALLE,ISAAC PERAL,MONTEAGUDO,"CALLE ISAAC PERAL, MONTEAGUDO",ISAAC PERAL(CALLE) en MONTEAGUDO
CL,CALLE,ISAAC PERAL,RAMOS LOS,"CALLE ISAAC PERAL, RAMOS LOS",ISAAC PERAL(CALLE) en RAMOS LOS
CL,CALLE,ISAAC PERAL,SANGONERA SECA,"CALLE ISAAC PERAL, SANGONERA SECA",ISAAC PERAL(CALLE) en SANGONERA SECA
CL,CALLE,ISAAC PERAL,SANTO ANGEL,"CALLE ISAAC PERAL, SANTO ANGEL",ISAAC PERAL(CALLE) en SANTO ANGEL
CL,CALLE,ISAAC PERAL,ZARANDONA,"CALLE ISAAC PERAL, ZARANDONA",ISAAC PERAL(CALLE) en ZARANDONA
CL,CALLE,ISABEL BELLVIS,CORVERA,"CALLE ISABEL BELLVIS, CORVERA",ISABEL BELLVIS(CALLE) en CORVERA
CL,CALLE,ISABEL CATOLICA,EL PALMAR,"CALLE ISABEL CATOLICA, EL PALMAR",ISABEL CATOLICA(CALLE) en EL PALMAR
CL,CALLE,ISABEL CATOLICA,MURCIA,"CALLE ISABEL CATOLICA, MURCIA",ISABEL CATOLICA(CALLE) en MURCIA
CL,CALLE,ISABEL II,CABEZO TORRES,"CALLE ISABEL II, CABEZO TORRES",ISABEL II(CALLE) en CABEZO TORRES
CL,CALLE,ISABEL II,MURCIA,"CALLE ISABEL II, MURCIA",ISABEL II(CALLE) en MURCIA
CL,CALLE,ISABEL LA CATOLICA,ESPARRAGAL,"CALLE ISABEL LA CATOLICA, ESPARRAGAL",ISABEL LA CATOLICA(CALLE) en ESPARRAGAL
CL,CALLE,ISABEL MESEGUER GALANT,ALQUERIAS,"CALLE ISABEL MESEGUER GALANT, ALQUERIAS",ISABEL MESEGUER GALANT(CALLE) en ALQUERIAS
CL,CALLE,ISABEL NAVARRO,SAN BENITO,"CALLE ISABEL NAVARRO, SAN BENITO",ISABEL NAVARRO(CALLE) en SAN BENITO
CL,CALLE,I SECTOR ZB-PM7,EL PALMAR,"CALLE I SECTOR ZB-PM7, EL PALMAR",I SECTOR ZB-PM7(CALLE) en EL PALMAR
CL,CALLE,ISIDORO CIERVA,MURCIA,"CALLE ISIDORO CIERVA, MURCIA",ISIDORO CIERVA(CALLE) en MURCIA
CL,CALLE,ISIDORO DE LA CIERVA,SANTO ANGEL,"CALLE ISIDORO DE LA CIERVA, SANTO ANGEL",ISIDORO DE LA CIERVA(CALLE) en SANTO ANGEL
CL,CALLE,ISIDOROS,ZARANDONA,"CALLE ISIDOROS, ZARANDONA",ISIDOROS(CALLE) en ZARANDONA
CL,CALLE,ISLA CAPRI,ESPARRAGAL,"CALLE ISLA CAPRI, ESPARRAGAL",ISLA CAPRI(CALLE) en ESPARRAGAL
CL,CALLE,ISLA CRISTINA,MURCIA,"CALLE ISLA CRISTINA, MURCIA",ISLA CRISTINA(CALLE) en MURCIA
CL,CALLE,ISLA DE LAS PALOMAS,ESPARRAGAL,"CALLE ISLA DE LAS PALOMAS, ESPARRAGAL",ISLA DE LAS PALOMAS(CALLE) en ESPARRAGAL
CL,CALLE,ISLA DEL BARON,ESPARRAGAL,"CALLE ISLA DEL BARON, ESPARRAGAL",ISLA DEL BARON(CALLE) en ESPARRAGAL
CL,CALLE,ISLA GROSSA,ESPARRAGAL,"CALLE ISLA GROSSA, ESPARRAGAL",ISLA GROSSA(CALLE) en ESPARRAGAL
CL,CALLE,ISLA MAYOR,ESPARRAGAL,"CALLE ISLA MAYOR, ESPARRAGAL",ISLA MAYOR(CALLE) en ESPARRAGAL
CL,CALLE,ISLA PERDIGUERA,ESPARRAGAL,"CALLE ISLA PERDIGUERA, ESPARRAGAL",ISLA PERDIGUERA(CALLE) en ESPARRAGAL
CL,CALLE,ISLA PLANA,ESPARRAGAL,"CALLE ISLA PLANA, ESPARRAGAL",ISLA PLANA(CALLE) en ESPARRAGAL
CL,CALLE,I UA1 PP ZM-DR3,SAN BENITO,"CALLE I UA1 PP ZM-DR3, SAN BENITO",I UA1 PP ZM-DR3(CALLE) en SAN BENITO
CL,CALLE,I (ZM-SA1),SANTO ANGEL,"CALLE I (ZM-SA1), SANTO ANGEL",I (ZM-SA1)(CALLE) en SANTO ANGEL
CL,CALLE,JABONERIAS,MURCIA,"CALLE JABONERIAS, MURCIA",JABONERIAS(CALLE) en MURCIA
CL,CALLE,JACARANDA - TORREGUIL,SANGONERA VERDE,"CALLE JACARANDA - TORREGUIL, SANGONERA VERDE",JACARANDA - TORREGUIL(CALLE) en SANGONERA VERDE
CL,CALLE,JACINTO BENAVENTE,ESPARRAGAL,"CALLE JACINTO BENAVENTE, ESPARRAGAL",JACINTO BENAVENTE(CALLE) en ESPARRAGAL
CL,CALLE,JACINTO BENAVENTE,SUCINA,"CALLE JACINTO BENAVENTE, SUCINA",JACINTO BENAVENTE(CALLE) en SUCINA
CL,CALLE,JACINTO POLO DE MEDINA,LA CUEVA,"CALLE JACINTO POLO DE MEDINA, LA CUEVA",JACINTO POLO DE MEDINA(CALLE) en LA CUEVA
CL,CALLE,JACINTOS,EL PALMAR,"CALLE JACINTOS, EL PALMAR",JACINTOS(CALLE) en EL PALMAR
CL,CALLE,JACOBO LEYES,MURCIA,"CALLE JACOBO LEYES, MURCIA",JACOBO LEYES(CALLE) en MURCIA
CL,CALLE,JACOBO RUIZ,ALBERCA LA,"CALLE JACOBO RUIZ, ALBERCA LA",JACOBO RUIZ(CALLE) en ALBERCA LA
CL,CALLE,JACQUES COUSTEAU,JAVALI NUEVO,"CALLE JACQUES COUSTEAU, JAVALI NUEVO",JACQUES COUSTEAU(CALLE) en JAVALI NUEVO
CL,CALLE,JAIME BALMES,SANGONERA VERDE,"CALLE JAIME BALMES, SANGONERA VERDE",JAIME BALMES(CALLE) en SANGONERA VERDE
CL,CALLE,JAIME I,CABEZO TORRES,"CALLE JAIME I, CABEZO TORRES",JAIME I(CALLE) en CABEZO TORRES
CL,CALLE,JAIME VELASCO,BENIAJAN,"CALLE JAIME VELASCO, BENIAJAN",JAIME VELASCO(CALLE) en BENIAJAN
CL,CALLE,JARA CARRILLO,ALBERCA LA,"CALLE JARA CARRILLO, ALBERCA LA",JARA CARRILLO(CALLE) en ALBERCA LA
CL,CALLE,JARA CARRILLO,ALGEZARES,"CALLE JARA CARRILLO, ALGEZARES",JARA CARRILLO(CALLE) en ALGEZARES
CL,CALLE,JARA CARRILLO,EL PALMAR,"CALLE JARA CARRILLO, EL PALMAR",JARA CARRILLO(CALLE) en EL PALMAR
CL,CALLE,JARA CARRILLO,MURCIA,"CALLE JARA CARRILLO, MURCIA",JARA CARRILLO(CALLE) en MURCIA
CL,CALLE,JARA CARRILLO,PUENTE TOCINOS,"CALLE JARA CARRILLO, PUENTE TOCINOS",JARA CARRILLO(CALLE) en PUENTE TOCINOS
CL,CALLE,JARA CARRILLO,PUNTAL EL,"CALLE JARA CARRILLO, PUNTAL EL",JARA CARRILLO(CALLE) en PUNTAL EL
CL,CALLE,JARA CARRILLO,TORREAGUERA,"CALLE JARA CARRILLO, TORREAGUERA",JARA CARRILLO(CALLE) en TORREAGUERA
CL,CALLE,JARALES,COBATILLAS,"CALLE JARALES, COBATILLAS",JARALES(CALLE) en COBATILLAS
CL,CALLE,JARA - TORREGUIL,SANGONERA VERDE,"CALLE JARA - TORREGUIL, SANGONERA VERDE",JARA - TORREGUIL(CALLE) en SANGONERA VERDE
CL,CALLE,JARDIEL PONCELA,MONTEAGUDO,"CALLE JARDIEL PONCELA, MONTEAGUDO",JARDIEL PONCELA(CALLE) en MONTEAGUDO
CL,CALLE,JARDIN ALJADA,PUENTE TOCINOS,"CALLE JARDIN ALJADA, PUENTE TOCINOS",JARDIN ALJADA(CALLE) en PUENTE TOCINOS
CL,CALLE,JARDIN,ALJUCER,"CALLE JARDIN, ALJUCER",JARDIN(CALLE) en ALJUCER
CL,CALLE,JARDIN DE LOS GERANIOS,ZARANDONA,"CALLE JARDIN DE LOS GERANIOS, ZARANDONA",JARDIN DE LOS GERANIOS(CALLE) en ZARANDONA
CL,CALLE,JARDIN DE PONIENTE,GUADALUPE,"CALLE JARDIN DE PONIENTE, GUADALUPE",JARDIN DE PONIENTE(CALLE) en GUADALUPE
CL,CALLE,JARDIN DE PONIENTE,JAVALI NUEVO,"CALLE JARDIN DE PONIENTE, JAVALI NUEVO",JARDIN DE PONIENTE(CALLE) en JAVALI NUEVO
CL,CALLE,JARDIN,EL SECANO,"CALLE JARDIN, EL SECANO",JARDIN(CALLE) en EL SECANO
CL,CALLE,JARDINES,PUNTAL EL,"CALLE JARDINES, PUNTAL EL",JARDINES(CALLE) en PUNTAL EL
CL,CALLE,JARDIN,JAVALI NUEVO,"CALLE JARDIN, JAVALI NUEVO",JARDIN(CALLE) en JAVALI NUEVO
CL,CALLE,JARDIN LEVANTE,GUADALUPE,"CALLE JARDIN LEVANTE, GUADALUPE",JARDIN LEVANTE(CALLE) en GUADALUPE
CL,CALLE,JARDIN,LLANO BRUJAS,"CALLE JARDIN, LLANO BRUJAS",JARDIN(CALLE) en LLANO BRUJAS
CL,CALLE,JARDIN MURCIA,PUNTAL EL,"CALLE JARDIN MURCIA, PUNTAL EL",JARDIN MURCIA(CALLE) en PUNTAL EL
CL,CALLE,JARDIN,SANGONERA VERDE,"CALLE JARDIN, SANGONERA VERDE",JARDIN(CALLE) en SANGONERA VERDE
CL,CALLE,JARDIN,SAN JOSE,"CALLE JARDIN, SAN JOSE",JARDIN(CALLE) en SAN JOSE
CL,CALLE,JARDIN,TORREAGUERA,"CALLE JARDIN, TORREAGUERA",JARDIN(CALLE) en TORREAGUERA
CL,CALLE,JAZMIN,ALGEZARES,"CALLE JAZMIN, ALGEZARES",JAZMIN(CALLE) en ALGEZARES
CL,CALLE,JAZMIN,CHURRA,"CALLE JAZMIN, CHURRA",JAZMIN(CALLE) en CHURRA
CL,CALLE,JAZMINES,COBATILLAS,"CALLE JAZMINES, COBATILLAS",JAZMINES(CALLE) en COBATILLAS
CL,CALLE,JAZMINES,EL PALMAR,"CALLE JAZMINES, EL PALMAR",JAZMINES(CALLE) en EL PALMAR
CL,CALLE,JAZMINES,MURCIA,"CALLE JAZMINES, MURCIA",JAZMINES(CALLE) en MURCIA
CL,CALLE,JAZMIN,MURCIA,"CALLE JAZMIN, MURCIA",JAZMIN(CALLE) en MURCIA
CL,CALLE,JAZMIN,PUENTE TOCINOS,"CALLE JAZMIN, PUENTE TOCINOS",JAZMIN(CALLE) en PUENTE TOCINOS
CL,CALLE,JAZMIN,SAN BENITO,"CALLE JAZMIN, SAN BENITO",JAZMIN(CALLE) en SAN BENITO
CL,CALLE,JAZMIN,SANGONERA VERDE,"CALLE JAZMIN, SANGONERA VERDE",JAZMIN(CALLE) en SANGONERA VERDE
CL,CALLE,JAZMIN,TORREAGUERA,"CALLE JAZMIN, TORREAGUERA",JAZMIN(CALLE) en TORREAGUERA
CL,CALLE,JEREZ -UR.AGRIDULCE,GUADALUPE,"CALLE JEREZ -UR.AGRIDULCE, GUADALUPE",JEREZ -UR.AGRIDULCE(CALLE) en GUADALUPE
CL,CALLE,JEROMIN,SAN BENITO,"CALLE JEROMIN, SAN BENITO",JEROMIN(CALLE) en SAN BENITO
CL,CALLE,JERONIMO GUIJARRO,MURCIA,"CALLE JERONIMO GUIJARRO, MURCIA",JERONIMO GUIJARRO(CALLE) en MURCIA
CL,CALLE,JERONIMO MOLINA GARCIA,SAN BENITO,"CALLE JERONIMO MOLINA GARCIA, SAN BENITO",JERONIMO MOLINA GARCIA(CALLE) en SAN BENITO
CL,CALLE,JERONIMO MOLINA,MURCIA,"CALLE JERONIMO MOLINA, MURCIA",JERONIMO MOLINA(CALLE) en MURCIA
CL,CALLE,JERONIMO RODA,MURCIA,"CALLE JERONIMO RODA, MURCIA",JERONIMO RODA(CALLE) en MURCIA
CL,CALLE,JESUS BELANDO,SAN BENITO,"CALLE JESUS BELANDO, SAN BENITO",JESUS BELANDO(CALLE) en SAN BENITO
CL,CALLE,JESUS ESTEBAN,MURCIA,"CALLE JESUS ESTEBAN, MURCIA",JESUS ESTEBAN(CALLE) en MURCIA
CL,CALLE,JESUS HERNANDEZ CONESA,ZARANDONA,"CALLE JESUS HERNANDEZ CONESA, ZARANDONA",JESUS HERNANDEZ CONESA(CALLE) en ZARANDONA
CL,CALLE,JESUS HURTADO,MURCIA,"CALLE JESUS HURTADO, MURCIA",JESUS HURTADO(CALLE) en MURCIA
CL,CALLE,JESUS MONTOYA,CABEZO TORRES,"CALLE JESUS MONTOYA, CABEZO TORRES",JESUS MONTOYA(CALLE) en CABEZO TORRES
CL,CALLE,JESUS MONTOYA,PUENTE TOCINOS,"CALLE JESUS MONTOYA, PUENTE TOCINOS",JESUS MONTOYA(CALLE) en PUENTE TOCINOS
CL,CALLE,JESUS MORENO,ALJUCER,"CALLE JESUS MORENO, ALJUCER",JESUS MORENO(CALLE) en ALJUCER
CL,CALLE,JILGUERO - TORREGUIL,SANGONERA VERDE,"CALLE JILGUERO - TORREGUIL, SANGONERA VERDE",JILGUERO - TORREGUIL(CALLE) en SANGONERA VERDE
CL,CALLE,JIMENEZ BAEZA,MURCIA,"CALLE JIMENEZ BAEZA, MURCIA",JIMENEZ BAEZA(CALLE) en MURCIA
CL,CALLE,JOAN MIRO,ESPARRAGAL,"CALLE JOAN MIRO, ESPARRAGAL",JOAN MIRO(CALLE) en ESPARRAGAL
CL,CALLE,JOAN MIRO,LAS LUMBRERAS,"CALLE JOAN MIRO, LAS LUMBRERAS",JOAN MIRO(CALLE) en LAS LUMBRERAS
CL,CALLE,JOAN MIRO,MARTINEZ PUERTO,"CALLE JOAN MIRO, MARTINEZ PUERTO",JOAN MIRO(CALLE) en MARTINEZ PUERTO
CL,CALLE,JOAN MIRO,VALLADOLISES,"CALLE JOAN MIRO, VALLADOLISES",JOAN MIRO(CALLE) en VALLADOLISES
CL,CALLE,JOAQUIN ARDERIUS,LAS LUMBRERAS,"CALLE JOAQUIN ARDERIUS, LAS LUMBRERAS",JOAQUIN ARDERIUS(CALLE) en LAS LUMBRERAS
CL,CALLE,JOAQUINAS,JERON.-AVILESES,"CALLE JOAQUINAS, JERON.-AVILESES",JOAQUINAS(CALLE) en JERON.-AVILESES
CL,CALLE,JOAQUIN BAGUENA,MURCIA,"CALLE JOAQUIN BAGUENA, MURCIA",JOAQUIN BAGUENA(CALLE) en MURCIA
CL,CALLE,JOAQUIN BLUME,MURCIA,"CALLE JOAQUIN BLUME, MURCIA",JOAQUIN BLUME(CALLE) en MURCIA
CL,CALLE,JOAQUIN COSTA,ALGEZARES,"CALLE JOAQUIN COSTA, ALGEZARES",JOAQUIN COSTA(CALLE) en ALGEZARES
CL,CALLE,JOAQUIN COSTA,MURCIA,"CALLE JOAQUIN COSTA, MURCIA",JOAQUIN COSTA(CALLE) en MURCIA
CL,CALLE,JOAQUIN ESTEBAN GUERRERO,MURCIA,"CALLE JOAQUIN ESTEBAN GUERRERO, MURCIA",JOAQUIN ESTEBAN GUERRERO(CALLE) en MURCIA
CL,CALLE,JONI,TORREAGUERA,"CALLE JONI, TORREAGUERA",JONI(CALLE) en TORREAGUERA
