codigo,TipoVia,NombreVia,barrio,via,ViaCatastro
DS,DISEMINADO,CARRIL BASILIO,CASILLAS,"DISEMINADO CARRIL BASILIO, CASILLAS",CARRIL BASILIO(DISEMINADO) en CASILLAS
DS,DISEMINADO,CARRIL BASILIOS,ERA ALTA,"DISEMINADO CARRIL BASILIOS, ERA ALTA",CARRIL BASILIOS(DISEMINADO) en ERA ALTA
DS,DISEMINADO,CARRIL BASTIDAS,ALJUCER,"DISEMINADO CARRIL BASTIDAS, ALJUCER",CARRIL BASTIDAS(DISEMINADO) en ALJUCER
DS,DISEMINADO,CARRIL BASTIDAS,NONDUERMAS,"DISEMINADO CARRIL BASTIDAS, NONDUERMAS",CARRIL BASTIDAS(DISEMINADO) en NONDUERMAS
DS,DISEMINADO,CARRIL BAUTISTAS,RAAL EL,"DISEMINADO CARRIL BAUTISTAS, RAAL EL",CARRIL BAUTISTAS(DISEMINADO) en RAAL EL
DS,DISEMINADO,CARRIL BAYETOS,ERA ALTA,"DISEMINADO CARRIL BAYETOS, ERA ALTA",CARRIL BAYETOS(DISEMINADO) en ERA ALTA
DS,DISEMINADO,CARRIL BELANDOS,BENIAJAN,"DISEMINADO CARRIL BELANDOS, BENIAJAN",CARRIL BELANDOS(DISEMINADO) en BENIAJAN
DS,DISEMINADO,CARRIL BELLUGA,DOLORES LOS,"DISEMINADO CARRIL BELLUGA, DOLORES LOS",CARRIL BELLUGA(DISEMINADO) en DOLORES LOS
DS,DISEMINADO,CARRIL BELMONTES,RINCON SECA,"DISEMINADO CARRIL BELMONTES, RINCON SECA",CARRIL BELMONTES(DISEMINADO) en RINCON SECA
DS,DISEMINADO,CARRIL BELTRANA,PUEBLA DE SOTO,"DISEMINADO CARRIL BELTRANA, PUEBLA DE SOTO",CARRIL BELTRANA(DISEMINADO) en PUEBLA DE SOTO
DS,DISEMINADO,CARRIL BENITOS,CABEZO TORRES,"DISEMINADO CARRIL BENITOS, CABEZO TORRES",CARRIL BENITOS(DISEMINADO) en CABEZO TORRES
DS,DISEMINADO,CARRIL BENITOS,ZARANDONA,"DISEMINADO CARRIL BENITOS, ZARANDONA",CARRIL BENITOS(DISEMINADO) en ZARANDONA
DS,DISEMINADO,CARRIL BERNABELES,PUENTE TOCINOS,"DISEMINADO CARRIL BERNABELES, PUENTE TOCINOS",CARRIL BERNABELES(DISEMINADO) en PUENTE TOCINOS
DS,DISEMINADO,CARRIL BERNABE,ZARANDONA,"DISEMINADO CARRIL BERNABE, ZARANDONA",CARRIL BERNABE(DISEMINADO) en ZARANDONA
DS,DISEMINADO,CARRIL BLASETES,ZARANDONA,"DISEMINADO CARRIL BLASETES, ZARANDONA",CARRIL BLASETES(DISEMINADO) en ZARANDONA
DS,DISEMINADO,CARRIL BODEGAS,LLANO BRUJAS,"DISEMINADO CARRIL BODEGAS, LLANO BRUJAS",CARRIL BODEGAS(DISEMINADO) en LLANO BRUJAS
DS,DISEMINADO,CARRIL BOLIS,ALJUCER,"DISEMINADO CARRIL BOLIS, ALJUCER",CARRIL BOLIS(DISEMINADO) en ALJUCER
DS,DISEMINADO,CARRIL BOLIS,EL PALMAR,"DISEMINADO CARRIL BOLIS, EL PALMAR",CARRIL BOLIS(DISEMINADO) en EL PALMAR
DS,DISEMINADO,CARRIL BOLSAS,LLANO BRUJAS,"DISEMINADO CARRIL BOLSAS, LLANO BRUJAS",CARRIL BOLSAS(DISEMINADO) en LLANO BRUJAS
DS,DISEMINADO,CARRIL BONACHES,ALBATALIA LA,"DISEMINADO CARRIL BONACHES, ALBATALIA LA",CARRIL BONACHES(DISEMINADO) en ALBATALIA LA
DS,DISEMINADO,CARRIL BORJAS,CABEZO TORRES,"DISEMINADO CARRIL BORJAS, CABEZO TORRES",CARRIL BORJAS(DISEMINADO) en CABEZO TORRES
DS,DISEMINADO,CARRIL BOTAS,ARBOLEJA LA,"DISEMINADO CARRIL BOTAS, ARBOLEJA LA",CARRIL BOTAS(DISEMINADO) en ARBOLEJA LA
DS,DISEMINADO,CARRIL BOTIAS,ALBATALIA LA,"DISEMINADO CARRIL BOTIAS, ALBATALIA LA",CARRIL BOTIAS(DISEMINADO) en ALBATALIA LA
DS,DISEMINADO,CARRIL BOTIAS,ALQUERIAS,"DISEMINADO CARRIL BOTIAS, ALQUERIAS",CARRIL BOTIAS(DISEMINADO) en ALQUERIAS
DS,DISEMINADO,CARRIL  BOTIAS,GUADALUPE,"DISEMINADO CARRIL  BOTIAS, GUADALUPE",CARRIL  BOTIAS(DISEMINADO) en GUADALUPE
DS,DISEMINADO,CARRIL BRAVOS,LLANO BRUJAS,"DISEMINADO CARRIL BRAVOS, LLANO BRUJAS",CARRIL BRAVOS(DISEMINADO) en LLANO BRUJAS
DS,DISEMINADO,CARRIL BRAZAL DEL REY,ALJUCER,"DISEMINADO CARRIL BRAZAL DEL REY, ALJUCER",CARRIL BRAZAL DEL REY(DISEMINADO) en ALJUCER
DS,DISEMINADO,CARRIL BRAZAL GRANDE,ERA ALTA,"DISEMINADO CARRIL BRAZAL GRANDE, ERA ALTA",CARRIL BRAZAL GRANDE(DISEMINADO) en ERA ALTA
DS,DISEMINADO,CARRIL BUENDIA,GARRES LOS,"DISEMINADO CARRIL BUENDIA, GARRES LOS",CARRIL BUENDIA(DISEMINADO) en GARRES LOS
DS,DISEMINADO,CARRIL BULGUEROS,ZARANDONA,"DISEMINADO CARRIL BULGUEROS, ZARANDONA",CARRIL BULGUEROS(DISEMINADO) en ZARANDONA
DS,DISEMINADO,CARRIL CABALLERO,PUEBLA DE SOTO,"DISEMINADO CARRIL CABALLERO, PUEBLA DE SOTO",CARRIL CABALLERO(DISEMINADO) en PUEBLA DE SOTO
DS,DISEMINADO,CARRIL CABALLEROS,ALJUCER,"DISEMINADO CARRIL CABALLEROS, ALJUCER",CARRIL CABALLEROS(DISEMINADO) en ALJUCER
DS,DISEMINADO,CARRIL CABALLEROS,NONDUERMAS,"DISEMINADO CARRIL CABALLEROS, NONDUERMAS",CARRIL CABALLEROS(DISEMINADO) en NONDUERMAS
DS,DISEMINADO,CARRIL CABALLEROS,RINCON SECA,"DISEMINADO CARRIL CABALLEROS, RINCON SECA",CARRIL CABALLEROS(DISEMINADO) en RINCON SECA
DS,DISEMINADO,CARRIL CABEZOS,EL PALMAR,"DISEMINADO CARRIL CABEZOS, EL PALMAR",CARRIL CABEZOS(DISEMINADO) en EL PALMAR
DS,DISEMINADO,CARRIL CABILLOS,LLANO BRUJAS,"DISEMINADO CARRIL CABILLOS, LLANO BRUJAS",CARRIL CABILLOS(DISEMINADO) en LLANO BRUJAS
DS,DISEMINADO,CARRIL CABREROS,PUENTE TOCINOS,"DISEMINADO CARRIL CABREROS, PUENTE TOCINOS",CARRIL CABREROS(DISEMINADO) en PUENTE TOCINOS
DS,DISEMINADO,CARRIL CACHORROS,COBATILLAS,"DISEMINADO CARRIL CACHORROS, COBATILLAS",CARRIL CACHORROS(DISEMINADO) en COBATILLAS
DS,DISEMINADO,CARRIL CAETES,ERA ALTA,"DISEMINADO CARRIL CAETES, ERA ALTA",CARRIL CAETES(DISEMINADO) en ERA ALTA
DS,DISEMINADO,CARRIL CALAVERAS,DOLORES LOS,"DISEMINADO CARRIL CALAVERAS, DOLORES LOS",CARRIL CALAVERAS(DISEMINADO) en DOLORES LOS
DS,DISEMINADO,CARRIL CALESAS,ZARANDONA,"DISEMINADO CARRIL CALESAS, ZARANDONA",CARRIL CALESAS(DISEMINADO) en ZARANDONA
DS,DISEMINADO,CARRIL CAMACHES,PUENTE TOCINOS,"DISEMINADO CARRIL CAMACHES, PUENTE TOCINOS",CARRIL CAMACHES(DISEMINADO) en PUENTE TOCINOS
DS,DISEMINADO,CARRIL CAMARAS,COBATILLAS,"DISEMINADO CARRIL CAMARAS, COBATILLAS",CARRIL CAMARAS(DISEMINADO) en COBATILLAS
DS,DISEMINADO,CARRIL CAMARAS,LLANO BRUJAS,"DISEMINADO CARRIL CAMARAS, LLANO BRUJAS",CARRIL CAMARAS(DISEMINADO) en LLANO BRUJAS
DS,DISEMINADO,CARRIL CAMARAS,RAAL EL,"DISEMINADO CARRIL CAMARAS, RAAL EL",CARRIL CAMARAS(DISEMINADO) en RAAL EL
DS,DISEMINADO,CARRIL CAMPANILLA,CABEZO TORRES,"DISEMINADO CARRIL CAMPANILLA, CABEZO TORRES",CARRIL CAMPANILLA(DISEMINADO) en CABEZO TORRES
DS,DISEMINADO,CARRIL CAMPESINOS,SAN BENITO,"DISEMINADO CARRIL CAMPESINOS, SAN BENITO",CARRIL CAMPESINOS(DISEMINADO) en SAN BENITO
DS,DISEMINADO,CARRIL CAMPILLO,MONTEAGUDO,"DISEMINADO CARRIL CAMPILLO, MONTEAGUDO",CARRIL CAMPILLO(DISEMINADO) en MONTEAGUDO
DS,DISEMINADO,CARRIL CAMPOY,DOLORES LOS,"DISEMINADO CARRIL CAMPOY, DOLORES LOS",CARRIL CAMPOY(DISEMINADO) en DOLORES LOS
DS,DISEMINADO,CARRIL CAMPRANIZ,ZARANDONA,"DISEMINADO CARRIL CAMPRANIZ, ZARANDONA",CARRIL CAMPRANIZ(DISEMINADO) en ZARANDONA
DS,DISEMINADO,CARRIL CAMPUSINO,CASILLAS,"DISEMINADO CARRIL CAMPUSINO, CASILLAS",CARRIL CAMPUSINO(DISEMINADO) en CASILLAS
DS,DISEMINADO,CARRIL CANALES,DOLORES LOS,"DISEMINADO CARRIL CANALES, DOLORES LOS",CARRIL CANALES(DISEMINADO) en DOLORES LOS
DS,DISEMINADO,CARRIL CANOS,LLANO BRUJAS,"DISEMINADO CARRIL CANOS, LLANO BRUJAS",CARRIL CANOS(DISEMINADO) en LLANO BRUJAS
DS,DISEMINADO,CARRIL CANOS,PUENTE TOCINOS,"DISEMINADO CARRIL CANOS, PUENTE TOCINOS",CARRIL CANOS(DISEMINADO) en PUENTE TOCINOS
DS,DISEMINADO,CARRIL CANOVAS,CASILLAS,"DISEMINADO CARRIL CANOVAS, CASILLAS",CARRIL CANOVAS(DISEMINADO) en CASILLAS
DS,DISEMINADO,CARRIL CANOVAS,RAMOS LOS,"DISEMINADO CARRIL CANOVAS, RAMOS LOS",CARRIL CANOVAS(DISEMINADO) en RAMOS LOS
DS,DISEMINADO,CARRIL CAPITANES,SANGONERA VERDE,"DISEMINADO CARRIL CAPITANES, SANGONERA VERDE",CARRIL CAPITANES(DISEMINADO) en SANGONERA VERDE
DS,DISEMINADO,CARRIL CAPITAN,PUENTE TOCINOS,"DISEMINADO CARRIL CAPITAN, PUENTE TOCINOS",CARRIL CAPITAN(DISEMINADO) en PUENTE TOCINOS
DS,DISEMINADO,CARRIL CARAMILLOS,SAN BENITO,"DISEMINADO CARRIL CARAMILLOS, SAN BENITO",CARRIL CARAMILLOS(DISEMINADO) en SAN BENITO
DS,DISEMINADO,CARRIL CARAVACAS,CHURRA,"DISEMINADO CARRIL CARAVACAS, CHURRA",CARRIL CARAVACAS(DISEMINADO) en CHURRA
DS,DISEMINADO,CARRIL CARAVACAS,SAN BENITO,"DISEMINADO CARRIL CARAVACAS, SAN BENITO",CARRIL CARAVACAS(DISEMINADO) en SAN BENITO
DS,DISEMINADO,CARRIL CARCELEN,LLANO BRUJAS,"DISEMINADO CARRIL CARCELEN, LLANO BRUJAS",CARRIL CARCELEN(DISEMINADO) en LLANO BRUJAS
DS,DISEMINADO,CARRIL CARCELES,CABEZO TORRES,"DISEMINADO CARRIL CARCELES, CABEZO TORRES",CARRIL CARCELES(DISEMINADO) en CABEZO TORRES
DS,DISEMINADO,CARRIL CARCELES,GARRES LOS,"DISEMINADO CARRIL CARCELES, GARRES LOS",CARRIL CARCELES(DISEMINADO) en GARRES LOS
DS,DISEMINADO,CARRIL CARMELO,ALGEZARES,"DISEMINADO CARRIL CARMELO, ALGEZARES",CARRIL CARMELO(DISEMINADO) en ALGEZARES
DS,DISEMINADO,CARRIL CARMONAS,LLANO BRUJAS,"DISEMINADO CARRIL CARMONAS, LLANO BRUJAS",CARRIL CARMONAS(DISEMINADO) en LLANO BRUJAS
DS,DISEMINADO,CARRIL CAROLINA,PUENTE TOCINOS,"DISEMINADO CARRIL CAROLINA, PUENTE TOCINOS",CARRIL CAROLINA(DISEMINADO) en PUENTE TOCINOS
DS,DISEMINADO,CARRIL CARPIOS,ARBOLEJA LA,"DISEMINADO CARRIL CARPIOS, ARBOLEJA LA",CARRIL CARPIOS(DISEMINADO) en ARBOLEJA LA
DS,DISEMINADO,CARRIL CARRILEROS,ALBATALIA LA,"DISEMINADO CARRIL CARRILEROS, ALBATALIA LA",CARRIL CARRILEROS(DISEMINADO) en ALBATALIA LA
DS,DISEMINADO,CARRIL CARRILES,EL PALMAR,"DISEMINADO CARRIL CARRILES, EL PALMAR",CARRIL CARRILES(DISEMINADO) en EL PALMAR
DS,DISEMINADO,CARRIL CARRILLOS,SAN BENITO,"DISEMINADO CARRIL CARRILLOS, SAN BENITO",CARRIL CARRILLOS(DISEMINADO) en SAN BENITO
DS,DISEMINADO,CARRIL CARRILLOS,SANGONERA SECA,"DISEMINADO CARRIL CARRILLOS, SANGONERA SECA",CARRIL CARRILLOS(DISEMINADO) en SANGONERA SECA
DS,DISEMINADO,CARRIL CARRILLOS,ZENETA,"DISEMINADO CARRIL CARRILLOS, ZENETA",CARRIL CARRILLOS(DISEMINADO) en ZENETA
DS,DISEMINADO,CARRIL CARTEROS,RINCON SECA,"DISEMINADO CARRIL CARTEROS, RINCON SECA",CARRIL CARTEROS(DISEMINADO) en RINCON SECA
DS,DISEMINADO,CARRIL CASABLANCA,CABEZO TORRES,"DISEMINADO CARRIL CASABLANCA, CABEZO TORRES",CARRIL CASABLANCA(DISEMINADO) en CABEZO TORRES
DS,DISEMINADO,CARRIL CASA GRANDE,LLANO BRUJAS,"DISEMINADO CARRIL CASA GRANDE, LLANO BRUJAS",CARRIL CASA GRANDE(DISEMINADO) en LLANO BRUJAS
DS,DISEMINADO,CARRIL CASCALES,CASILLAS,"DISEMINADO CARRIL CASCALES, CASILLAS",CARRIL CASCALES(DISEMINADO) en CASILLAS
DS,DISEMINADO,CARRIL CASCALES,PUEBLA DE SOTO,"DISEMINADO CARRIL CASCALES, PUEBLA DE SOTO",CARRIL CASCALES(DISEMINADO) en PUEBLA DE SOTO
DS,DISEMINADO,CARRIL CASINOS,TORREAGUERA,"DISEMINADO CARRIL CASINOS, TORREAGUERA",CARRIL CASINOS(DISEMINADO) en TORREAGUERA
DS,DISEMINADO,CARRIL CATALANAS,PUENTE TOCINOS,"DISEMINADO CARRIL CATALANAS, PUENTE TOCINOS",CARRIL CATALANAS(DISEMINADO) en PUENTE TOCINOS
DS,DISEMINADO,CARRIL CAVERNERA,CHURRA,"DISEMINADO CARRIL CAVERNERA, CHURRA",CARRIL CAVERNERA(DISEMINADO) en CHURRA
DS,DISEMINADO,CARRIL CAVERNERAS,SAN BENITO,"DISEMINADO CARRIL CAVERNERAS, SAN BENITO",CARRIL CAVERNERAS(DISEMINADO) en SAN BENITO
DS,DISEMINADO,CARRIL CAYETANOS,LLANO BRUJAS,"DISEMINADO CARRIL CAYETANOS, LLANO BRUJAS",CARRIL CAYETANOS(DISEMINADO) en LLANO BRUJAS
DS,DISEMINADO,CARRIL CAYETANOS,ZARANDONA,"DISEMINADO CARRIL CAYETANOS, ZARANDONA",CARRIL CAYETANOS(DISEMINADO) en ZARANDONA
DS,DISEMINADO,CARRIL CEPO,DOLORES LOS,"DISEMINADO CARRIL CEPO, DOLORES LOS",CARRIL CEPO(DISEMINADO) en DOLORES LOS
DS,DISEMINADO,CARRIL CEREZOS,ALBATALIA LA,"DISEMINADO CARRIL CEREZOS, ALBATALIA LA",CARRIL CEREZOS(DISEMINADO) en ALBATALIA LA
DS,DISEMINADO,CARRIL CEREZOS,ARBOLEJA LA,"DISEMINADO CARRIL CEREZOS, ARBOLEJA LA",CARRIL CEREZOS(DISEMINADO) en ARBOLEJA LA
DS,DISEMINADO,CARRIL CEREZOS,GUADALUPE,"DISEMINADO CARRIL CEREZOS, GUADALUPE",CARRIL CEREZOS(DISEMINADO) en GUADALUPE
DS,DISEMINADO,CARRIL CESAREOS,ALQUERIAS,"DISEMINADO CARRIL CESAREOS, ALQUERIAS",CARRIL CESAREOS(DISEMINADO) en ALQUERIAS
DS,DISEMINADO,CARRIL CHALANES,SAN BENITO,"DISEMINADO CARRIL CHALANES, SAN BENITO",CARRIL CHALANES(DISEMINADO) en SAN BENITO
DS,DISEMINADO,CARRIL CHARLOT,ZARANDONA,"DISEMINADO CARRIL CHARLOT, ZARANDONA",CARRIL CHARLOT(DISEMINADO) en ZARANDONA
DS,DISEMINADO,CARRIL CHINARRAL,ERA ALTA,"DISEMINADO CARRIL CHINARRAL, ERA ALTA",CARRIL CHINARRAL(DISEMINADO) en ERA ALTA
DS,DISEMINADO,CARRIL CHIRLANCO,TORREAGUERA,"DISEMINADO CARRIL CHIRLANCO, TORREAGUERA",CARRIL CHIRLANCO(DISEMINADO) en TORREAGUERA
DS,DISEMINADO,CARRIL CHISPEAO,PUEBLA DE SOTO,"DISEMINADO CARRIL CHISPEAO, PUEBLA DE SOTO",CARRIL CHISPEAO(DISEMINADO) en PUEBLA DE SOTO
DS,DISEMINADO,CARRIL CHORIZO,ALGEZARES,"DISEMINADO CARRIL CHORIZO, ALGEZARES",CARRIL CHORIZO(DISEMINADO) en ALGEZARES
DS,DISEMINADO,CARRIL CHORNOS,ARBOLEJA LA,"DISEMINADO CARRIL CHORNOS, ARBOLEJA LA",CARRIL CHORNOS(DISEMINADO) en ARBOLEJA LA
DS,DISEMINADO,CARRIL CHULOS,RINCON BENISCOR,"DISEMINADO CARRIL CHULOS, RINCON BENISCOR",CARRIL CHULOS(DISEMINADO) en RINCON BENISCOR
DS,DISEMINADO,CARRIL CHUTTI,DOLORES LOS,"DISEMINADO CARRIL CHUTTI, DOLORES LOS",CARRIL CHUTTI(DISEMINADO) en DOLORES LOS
DS,DISEMINADO,CARRIL CIERVA,ALGEZARES,"DISEMINADO CARRIL CIERVA, ALGEZARES",CARRIL CIERVA(DISEMINADO) en ALGEZARES
DS,DISEMINADO,CARRIL CIERVA,RAMOS LOS,"DISEMINADO CARRIL CIERVA, RAMOS LOS",CARRIL CIERVA(DISEMINADO) en RAMOS LOS
DS,DISEMINADO,CARRIL CIPRESES,BENIAJAN,"DISEMINADO CARRIL CIPRESES, BENIAJAN",CARRIL CIPRESES(DISEMINADO) en BENIAJAN
DS,DISEMINADO,CARRIL CIPRESES,RAAL EL,"DISEMINADO CARRIL CIPRESES, RAAL EL",CARRIL CIPRESES(DISEMINADO) en RAAL EL
DS,DISEMINADO,CARRIL CIPRIANA,GUADALUPE,"DISEMINADO CARRIL CIPRIANA, GUADALUPE",CARRIL CIPRIANA(DISEMINADO) en GUADALUPE
DS,DISEMINADO,CARRIL CIVILA,RINCON SECA,"DISEMINADO CARRIL CIVILA, RINCON SECA",CARRIL CIVILA(DISEMINADO) en RINCON SECA
DS,DISEMINADO,CARRIL CLARAS,MONTEAGUDO,"DISEMINADO CARRIL CLARAS, MONTEAGUDO",CARRIL CLARAS(DISEMINADO) en MONTEAGUDO
DS,DISEMINADO,CARRIL CLEMENTES,LLANO BRUJAS,"DISEMINADO CARRIL CLEMENTES, LLANO BRUJAS",CARRIL CLEMENTES(DISEMINADO) en LLANO BRUJAS
DS,DISEMINADO,CARRIL CLERIGOS,ALBATALIA LA,"DISEMINADO CARRIL CLERIGOS, ALBATALIA LA",CARRIL CLERIGOS(DISEMINADO) en ALBATALIA LA
DS,DISEMINADO,CARRIL COBACHOS,GARRES LOS,"DISEMINADO CARRIL COBACHOS, GARRES LOS",CARRIL COBACHOS(DISEMINADO) en GARRES LOS
DS,DISEMINADO,CARRIL COJO CANALES,DOLORES LOS,"DISEMINADO CARRIL COJO CANALES, DOLORES LOS",CARRIL COJO CANALES(DISEMINADO) en DOLORES LOS
DS,DISEMINADO,CARRIL COLACHES,GARRES LOS,"DISEMINADO CARRIL COLACHES, GARRES LOS",CARRIL COLACHES(DISEMINADO) en GARRES LOS
DS,DISEMINADO,CARRIL COLASES,SAN JOSE,"DISEMINADO CARRIL COLASES, SAN JOSE",CARRIL COLASES(DISEMINADO) en SAN JOSE
DS,DISEMINADO,CARRIL COMINOS,RINCON SECA,"DISEMINADO CARRIL COMINOS, RINCON SECA",CARRIL COMINOS(DISEMINADO) en RINCON SECA
DS,DISEMINADO,CARRIL COMUNES,RAYA LA,"DISEMINADO CARRIL COMUNES, RAYA LA",CARRIL COMUNES(DISEMINADO) en RAYA LA
DS,DISEMINADO,CARRIL CONDE ALMODOVAR,ALQUERIAS,"DISEMINADO CARRIL CONDE ALMODOVAR, ALQUERIAS",CARRIL CONDE ALMODOVAR(DISEMINADO) en ALQUERIAS
DS,DISEMINADO,CARRIL CONDESA,SAN BENITO,"DISEMINADO CARRIL CONDESA, SAN BENITO",CARRIL CONDESA(DISEMINADO) en SAN BENITO
DS,DISEMINADO,CARRIL CONDOMINA,PUENTE TOCINOS,"DISEMINADO CARRIL CONDOMINA, PUENTE TOCINOS",CARRIL CONDOMINA(DISEMINADO) en PUENTE TOCINOS
DS,DISEMINADO,CARRIL CONEJERA,SAN BENITO,"DISEMINADO CARRIL CONEJERA, SAN BENITO",CARRIL CONEJERA(DISEMINADO) en SAN BENITO
DS,DISEMINADO,CARRIL CONGO,TORREAGUERA,"DISEMINADO CARRIL CONGO, TORREAGUERA",CARRIL CONGO(DISEMINADO) en TORREAGUERA
DS,DISEMINADO,CARRIL CORDOBAS,LLANO BRUJAS,"DISEMINADO CARRIL CORDOBAS, LLANO BRUJAS",CARRIL CORDOBAS(DISEMINADO) en LLANO BRUJAS
DS,DISEMINADO,CARRIL CORREAS,PUENTE TOCINOS,"DISEMINADO CARRIL CORREAS, PUENTE TOCINOS",CARRIL CORREAS(DISEMINADO) en PUENTE TOCINOS
DS,DISEMINADO,CARRIL COSTAS,NONDUERMAS,"DISEMINADO CARRIL COSTAS, NONDUERMAS",CARRIL COSTAS(DISEMINADO) en NONDUERMAS
DS,DISEMINADO,CARRIL CRISTIANOS,LLANO BRUJAS,"DISEMINADO CARRIL CRISTIANOS, LLANO BRUJAS",CARRIL CRISTIANOS(DISEMINADO) en LLANO BRUJAS
DS,DISEMINADO,CARRIL CRISTOBAL,ALQUERIAS,"DISEMINADO CARRIL CRISTOBAL, ALQUERIAS",CARRIL CRISTOBAL(DISEMINADO) en ALQUERIAS
DS,DISEMINADO,CARRIL CRUZ,ALBERCA LA,"DISEMINADO CARRIL CRUZ, ALBERCA LA",CARRIL CRUZ(DISEMINADO) en ALBERCA LA
DS,DISEMINADO,CARRIL CUARTEL,MONTEAGUDO,"DISEMINADO CARRIL CUARTEL, MONTEAGUDO",CARRIL CUARTEL(DISEMINADO) en MONTEAGUDO
DS,DISEMINADO,CARRIL CUATRO PIEDRAS,ARBOLEJA LA,"DISEMINADO CARRIL CUATRO PIEDRAS, ARBOLEJA LA",CARRIL CUATRO PIEDRAS(DISEMINADO) en ARBOLEJA LA
DS,DISEMINADO,CARRIL CUCHILLERO,ERA ALTA,"DISEMINADO CARRIL CUCHILLERO, ERA ALTA",CARRIL CUCHILLERO(DISEMINADO) en ERA ALTA
DS,DISEMINADO,CARRIL CUELLO,CHURRA,"DISEMINADO CARRIL CUELLO, CHURRA",CARRIL CUELLO(DISEMINADO) en CHURRA
DS,DISEMINADO,CARRIL CUEVAS,CABEZO TORRES,"DISEMINADO CARRIL CUEVAS, CABEZO TORRES",CARRIL CUEVAS(DISEMINADO) en CABEZO TORRES
DS,DISEMINADO,CARRIL CURANDERO,RAAL EL,"DISEMINADO CARRIL CURANDERO, RAAL EL",CARRIL CURANDERO(DISEMINADO) en RAAL EL
DS,DISEMINADO,CARRIL CURRO,CHURRA,"DISEMINADO CARRIL CURRO, CHURRA",CARRIL CURRO(DISEMINADO) en CHURRA
DS,DISEMINADO,CARRIL DAVID MARIN,BENIAJAN,"DISEMINADO CARRIL DAVID MARIN, BENIAJAN",CARRIL DAVID MARIN(DISEMINADO) en BENIAJAN
DS,DISEMINADO,CARRIL DE FELIX,ERA ALTA,"DISEMINADO CARRIL DE FELIX, ERA ALTA",CARRIL DE FELIX(DISEMINADO) en ERA ALTA
DS,DISEMINADO,CARRIL DE JACINTO,CABEZO TORRES,"DISEMINADO CARRIL DE JACINTO, CABEZO TORRES",CARRIL DE JACINTO(DISEMINADO) en CABEZO TORRES
DS,DISEMINADO,CARRIL DE LA CIERVA,SANTO ANGEL,"DISEMINADO CARRIL DE LA CIERVA, SANTO ANGEL",CARRIL DE LA CIERVA(DISEMINADO) en SANTO ANGEL
DS,DISEMINADO,CARRIL DE LA DOLORES,ALBATALIA LA,"DISEMINADO CARRIL DE LA DOLORES, ALBATALIA LA",CARRIL DE LA DOLORES(DISEMINADO) en ALBATALIA LA
DS,DISEMINADO,CARRIL DE LA LANDRONA,LLANO BRUJAS,"DISEMINADO CARRIL DE LA LANDRONA, LLANO BRUJAS",CARRIL DE LA LANDRONA(DISEMINADO) en LLANO BRUJAS
DS,DISEMINADO,CARRIL DE LA SER,MURCIA,"DISEMINADO CARRIL DE LA SER, MURCIA",CARRIL DE LA SER(DISEMINADO) en MURCIA
DS,DISEMINADO,CARRIL DE LA TORRE,GUADALUPE,"DISEMINADO CARRIL DE LA TORRE, GUADALUPE",CARRIL DE LA TORRE(DISEMINADO) en GUADALUPE
DS,DISEMINADO,CARRIL DE LA TORRE,TORREAGUERA,"DISEMINADO CARRIL DE LA TORRE, TORREAGUERA",CARRIL DE LA TORRE(DISEMINADO) en TORREAGUERA
DS,DISEMINADO,CARRIL DEL CARPINTERO,ERA ALTA,"DISEMINADO CARRIL DEL CARPINTERO, ERA ALTA",CARRIL DEL CARPINTERO(DISEMINADO) en ERA ALTA
DS,DISEMINADO,CARRIL DEL CAYUELA,ARBOLEJA LA,"DISEMINADO CARRIL DEL CAYUELA, ARBOLEJA LA",CARRIL DEL CAYUELA(DISEMINADO) en ARBOLEJA LA
DS,DISEMINADO,CARRIL DEL CHALET,ERA ALTA,"DISEMINADO CARRIL DEL CHALET, ERA ALTA",CARRIL DEL CHALET(DISEMINADO) en ERA ALTA
DS,DISEMINADO,CARRIL DEL CHALET,RINCON BENISCOR,"DISEMINADO CARRIL DEL CHALET, RINCON BENISCOR",CARRIL DEL CHALET(DISEMINADO) en RINCON BENISCOR
DS,DISEMINADO,CARRIL DEL FRAILE,DOLORES LOS,"DISEMINADO CARRIL DEL FRAILE, DOLORES LOS",CARRIL DEL FRAILE(DISEMINADO) en DOLORES LOS
DS,DISEMINADO,CARRIL DEL LARGO,DOLORES LOS,"DISEMINADO CARRIL DEL LARGO, DOLORES LOS",CARRIL DEL LARGO(DISEMINADO) en DOLORES LOS
DS,DISEMINADO,CARRIL DEL LUCIO,BENIAJAN,"DISEMINADO CARRIL DEL LUCIO, BENIAJAN",CARRIL DEL LUCIO(DISEMINADO) en BENIAJAN
DS,DISEMINADO,CARRIL DEL MENUO,EL PALMAR,"DISEMINADO CARRIL DEL MENUO, EL PALMAR",CARRIL DEL MENUO(DISEMINADO) en EL PALMAR
DS,DISEMINADO,CARRIL DEL MONTERON,BENIAJAN,"DISEMINADO CARRIL DEL MONTERON, BENIAJAN",CARRIL DEL MONTERON(DISEMINADO) en BENIAJAN
DS,DISEMINADO,CARRIL DEL NARANJAL,SANGONERA SECA,"DISEMINADO CARRIL DEL NARANJAL, SANGONERA SECA",CARRIL DEL NARANJAL(DISEMINADO) en SANGONERA SECA
DS,DISEMINADO,CARRIL DEL OBISPO,DOLORES LOS,"DISEMINADO CARRIL DEL OBISPO, DOLORES LOS",CARRIL DEL OBISPO(DISEMINADO) en DOLORES LOS
DS,DISEMINADO,CARRIL DE LOS BURROS,BENIAJAN,"DISEMINADO CARRIL DE LOS BURROS, BENIAJAN",CARRIL DE LOS BURROS(DISEMINADO) en BENIAJAN
DS,DISEMINADO,CARRIL DE LOS FUNES,GUADALUPE,"DISEMINADO CARRIL DE LOS FUNES, GUADALUPE",CARRIL DE LOS FUNES(DISEMINADO) en GUADALUPE
DS,DISEMINADO,CARRIL DE LOS GALLEGOS,ALJUCER,"DISEMINADO CARRIL DE LOS GALLEGOS, ALJUCER",CARRIL DE LOS GALLEGOS(DISEMINADO) en ALJUCER
DS,DISEMINADO,CARRIL DE LOS GOMEZ,GUADALUPE,"DISEMINADO CARRIL DE LOS GOMEZ, GUADALUPE",CARRIL DE LOS GOMEZ(DISEMINADO) en GUADALUPE
DS,DISEMINADO,CARRIL DE LOS GONZALEZ,CASILLAS,"DISEMINADO CARRIL DE LOS GONZALEZ, CASILLAS",CARRIL DE LOS GONZALEZ(DISEMINADO) en CASILLAS
DS,DISEMINADO,CARRIL DE LOS GUAPOS,LLANO BRUJAS,"DISEMINADO CARRIL DE LOS GUAPOS, LLANO BRUJAS",CARRIL DE LOS GUAPOS(DISEMINADO) en LLANO BRUJAS
DS,DISEMINADO,CARRIL DE LOS LORCAS,ARBOLEJA LA,"DISEMINADO CARRIL DE LOS LORCAS, ARBOLEJA LA",CARRIL DE LOS LORCAS(DISEMINADO) en ARBOLEJA LA
DS,DISEMINADO,CARRIL DE LOS PABLOS,LLANO BRUJAS,"DISEMINADO CARRIL DE LOS PABLOS, LLANO BRUJAS",CARRIL DE LOS PABLOS(DISEMINADO) en LLANO BRUJAS
DS,DISEMINADO,CARRIL DE LOS PEREZ,LLANO BRUJAS,"DISEMINADO CARRIL DE LOS PEREZ, LLANO BRUJAS",CARRIL DE LOS PEREZ(DISEMINADO) en LLANO BRUJAS
DS,DISEMINADO,CARRIL DE LOS QUEREDAS,TORREAGUERA,"DISEMINADO CARRIL DE LOS QUEREDAS, TORREAGUERA",CARRIL DE LOS QUEREDAS(DISEMINADO) en TORREAGUERA
DS,DISEMINADO,CARRIL DE LOS SEGADORES,GARRES LOS,"DISEMINADO CARRIL DE LOS SEGADORES, GARRES LOS",CARRIL DE LOS SEGADORES(DISEMINADO) en GARRES LOS
DS,DISEMINADO,CARRIL DE LOS SERNAS,LLANO BRUJAS,"DISEMINADO CARRIL DE LOS SERNAS, LLANO BRUJAS",CARRIL DE LOS SERNAS(DISEMINADO) en LLANO BRUJAS
DS,DISEMINADO,CARRIL DE LOS ZAMBUDIOS,ALJUCER,"DISEMINADO CARRIL DE LOS ZAMBUDIOS, ALJUCER",CARRIL DE LOS ZAMBUDIOS(DISEMINADO) en ALJUCER
DS,DISEMINADO,CARRIL DEL PINO,PUENTE TOCINOS,"DISEMINADO CARRIL DEL PINO, PUENTE TOCINOS",CARRIL DEL PINO(DISEMINADO) en PUENTE TOCINOS
DS,DISEMINADO,CARRIL DEL RINCON,ARBOLEJA LA,"DISEMINADO CARRIL DEL RINCON, ARBOLEJA LA",CARRIL DEL RINCON(DISEMINADO) en ARBOLEJA LA
DS,DISEMINADO,CARRIL DEL ROQUE,ARBOLEJA LA,"DISEMINADO CARRIL DEL ROQUE, ARBOLEJA LA",CARRIL DEL ROQUE(DISEMINADO) en ARBOLEJA LA
DS,DISEMINADO,CARRIL DEMETRIO,ALJUCER,"DISEMINADO CARRIL DEMETRIO, ALJUCER",CARRIL DEMETRIO(DISEMINADO) en ALJUCER
DS,DISEMINADO,CARRIL DEPURADORA,ZARANDONA,"DISEMINADO CARRIL DEPURADORA, ZARANDONA",CARRIL DEPURADORA(DISEMINADO) en ZARANDONA
DS,DISEMINADO,CARRIL DIEGUILLO,ALQUERIAS,"DISEMINADO CARRIL DIEGUILLO, ALQUERIAS",CARRIL DIEGUILLO(DISEMINADO) en ALQUERIAS
DS,DISEMINADO,CARRIL DOS HERMANAS,GUADALUPE,"DISEMINADO CARRIL DOS HERMANAS, GUADALUPE",CARRIL DOS HERMANAS(DISEMINADO) en GUADALUPE
DS,DISEMINADO,CARRIL EL DATIL,RAAL EL,"DISEMINADO CARRIL EL DATIL, RAAL EL",CARRIL EL DATIL(DISEMINADO) en RAAL EL
DS,DISEMINADO,CARRIL ENERA,DOLORES LOS,"DISEMINADO CARRIL ENERA, DOLORES LOS",CARRIL ENERA(DISEMINADO) en DOLORES LOS
DS,DISEMINADO,CARRIL ERMITA,ALJUCER,"DISEMINADO CARRIL ERMITA, ALJUCER",CARRIL ERMITA(DISEMINADO) en ALJUCER
DS,DISEMINADO,CARRIL ERMITA REMEDIOS,PUENTE TOCINOS,"DISEMINADO CARRIL ERMITA REMEDIOS, PUENTE TOCINOS",CARRIL ERMITA REMEDIOS(DISEMINADO) en PUENTE TOCINOS
DS,DISEMINADO,CARRIL ERMITA VIEJA,PUENTE TOCINOS,"DISEMINADO CARRIL ERMITA VIEJA, PUENTE TOCINOS",CARRIL ERMITA VIEJA(DISEMINADO) en PUENTE TOCINOS
DS,DISEMINADO,CARRIL ESCARABAJAL,DOLORES LOS,"DISEMINADO CARRIL ESCARABAJAL, DOLORES LOS",CARRIL ESCARABAJAL(DISEMINADO) en DOLORES LOS
DS,DISEMINADO,CARRIL ESCARAVAJAL,DOLORES LOS,"DISEMINADO CARRIL ESCARAVAJAL, DOLORES LOS",CARRIL ESCARAVAJAL(DISEMINADO) en DOLORES LOS
DS,DISEMINADO,CARRIL ESCRIBANOS,SAN JOSE,"DISEMINADO CARRIL ESCRIBANOS, SAN JOSE",CARRIL ESCRIBANOS(DISEMINADO) en SAN JOSE
DS,DISEMINADO,CARRIL ESCUDERA,PUEBLA DE SOTO,"DISEMINADO CARRIL ESCUDERA, PUEBLA DE SOTO",CARRIL ESCUDERA(DISEMINADO) en PUEBLA DE SOTO
DS,DISEMINADO,CARRIL ESCUELA EQUIPO,SAN BENITO,"DISEMINADO CARRIL ESCUELA EQUIPO, SAN BENITO",CARRIL ESCUELA EQUIPO(DISEMINADO) en SAN BENITO
DS,DISEMINADO,CARRIL ESCUELAS,ALBATALIA LA,"DISEMINADO CARRIL ESCUELAS, ALBATALIA LA",CARRIL ESCUELAS(DISEMINADO) en ALBATALIA LA
DS,DISEMINADO,CARRIL ESCUELAS,ARBOLEJA LA,"DISEMINADO CARRIL ESCUELAS, ARBOLEJA LA",CARRIL ESCUELAS(DISEMINADO) en ARBOLEJA LA
DS,DISEMINADO,CARRIL ESCUELAS,DOLORES LOS,"DISEMINADO CARRIL ESCUELAS, DOLORES LOS",CARRIL ESCUELAS(DISEMINADO) en DOLORES LOS
DS,DISEMINADO,CARRIL ESPARZAS,ARBOLEJA LA,"DISEMINADO CARRIL ESPARZAS, ARBOLEJA LA",CARRIL ESPARZAS(DISEMINADO) en ARBOLEJA LA
DS,DISEMINADO,CARRIL ESTEVE,ARBOLEJA LA,"DISEMINADO CARRIL ESTEVE, ARBOLEJA LA",CARRIL ESTEVE(DISEMINADO) en ARBOLEJA LA
DS,DISEMINADO,CARRIL EUGENIOS,ALQUERIAS,"DISEMINADO CARRIL EUGENIOS, ALQUERIAS",CARRIL EUGENIOS(DISEMINADO) en ALQUERIAS
DS,DISEMINADO,CARRIL EUGENIOS,ZARANDONA,"DISEMINADO CARRIL EUGENIOS, ZARANDONA",CARRIL EUGENIOS(DISEMINADO) en ZARANDONA
DS,DISEMINADO,CARRIL FELIPE,SANTO ANGEL,"DISEMINADO CARRIL FELIPE, SANTO ANGEL",CARRIL FELIPE(DISEMINADO) en SANTO ANGEL
DS,DISEMINADO,CARRIL FELIX,BENIAJAN,"DISEMINADO CARRIL FELIX, BENIAJAN",CARRIL FELIX(DISEMINADO) en BENIAJAN
DS,DISEMINADO,CARRIL FILOMENA,PUENTE TOCINOS,"DISEMINADO CARRIL FILOMENA, PUENTE TOCINOS",CARRIL FILOMENA(DISEMINADO) en PUENTE TOCINOS
DS,DISEMINADO,CARRIL FLORERO,MURCIA,"DISEMINADO CARRIL FLORERO, MURCIA",CARRIL FLORERO(DISEMINADO) en MURCIA
DS,DISEMINADO,CARRIL FLORES,DOLORES LOS,"DISEMINADO CARRIL FLORES, DOLORES LOS",CARRIL FLORES(DISEMINADO) en DOLORES LOS
DS,DISEMINADO,CARRIL FLOROS,NONDUERMAS,"DISEMINADO CARRIL FLOROS, NONDUERMAS",CARRIL FLOROS(DISEMINADO) en NONDUERMAS
DS,DISEMINADO,CARRIL FOTOGRAFO,ALBATALIA LA,"DISEMINADO CARRIL FOTOGRAFO, ALBATALIA LA",CARRIL FOTOGRAFO(DISEMINADO) en ALBATALIA LA
DS,DISEMINADO,CARRIL FRANCES,ALBATALIA LA,"DISEMINADO CARRIL FRANCES, ALBATALIA LA",CARRIL FRANCES(DISEMINADO) en ALBATALIA LA
DS,DISEMINADO,CARRIL FRANCISCO PAREDES,PUENTE TOCINOS,"DISEMINADO CARRIL FRANCISCO PAREDES, PUENTE TOCINOS",CARRIL FRANCISCO PAREDES(DISEMINADO) en PUENTE TOCINOS
DS,DISEMINADO,CARRIL FRANCISCO ROBLES,ALQUERIAS,"DISEMINADO CARRIL FRANCISCO ROBLES, ALQUERIAS",CARRIL FRANCISCO ROBLES(DISEMINADO) en ALQUERIAS
DS,DISEMINADO,CARRIL FRANCOS,ALJUCER,"DISEMINADO CARRIL FRANCOS, ALJUCER",CARRIL FRANCOS(DISEMINADO) en ALJUCER
DS,DISEMINADO,CARRIL FRUCTUOSO,ARBOLEJA LA,"DISEMINADO CARRIL FRUCTUOSO, ARBOLEJA LA",CARRIL FRUCTUOSO(DISEMINADO) en ARBOLEJA LA
DS,DISEMINADO,CARRIL FRUTOS 1,SAN BENITO,"DISEMINADO CARRIL FRUTOS 1, SAN BENITO",CARRIL FRUTOS 1(DISEMINADO) en SAN BENITO
DS,DISEMINADO,CARRIL FRUTOS 2,SAN BENITO,"DISEMINADO CARRIL FRUTOS 2, SAN BENITO",CARRIL FRUTOS 2(DISEMINADO) en SAN BENITO
DS,DISEMINADO,CARRIL FRUTOS,ALBERCA LA,"DISEMINADO CARRIL FRUTOS, ALBERCA LA",CARRIL FRUTOS(DISEMINADO) en ALBERCA LA
DS,DISEMINADO,CARRIL FRUTOS,GARRES LOS,"DISEMINADO CARRIL FRUTOS, GARRES LOS",CARRIL FRUTOS(DISEMINADO) en GARRES LOS
